fuente,titulo,url,contenido,titulo_sugerido,resumen,imagenTechCrunch,How a 16-year-old company is easing small businesses into AI,https://techcrunch.com/2025/08/28/how-a-16-year-old-company-is-easing-small-businesses-into-ai/,"Amid all the “is this a bubble?” talk about artificial intelligence, the supply chain and logistics industries have become breeding grounds for seemingly genuine uses of the technology.Flexport,Uber Freight, and dozens ofstartupsare developing different applications and winning blue-chip customers.
But while AI helps Fortune 500s pad their bottom line (and justify the next layoff to Wall Street), the right use of the tech is proving useful to smaller businesses.
Netstock, an inventory management software company founded in 2009, is working on just that. It recently rolled out a generative AI-powered tool called the “Opportunity Engine” that slots into its existing customer dashboard. The tool pulls info from a customer’s Enterprise Resource Planning software and uses that information to make regular, real-time recommendations.
Netstock claims the tool is saving those businesses thousands. On Thursday, the company announced it has served up 1 million recommendations to date, and that 75% of its customers have received an Opportunity Engine suggestion valued at $50,000 or more.
While tantalizing, one of those customers — Bargreen Ellingson, a family-run 65-year-old restaurant supply company — was initially apprehensive about using an artificial intelligence product.
“Old family companies don’t trust blind change a lot,” chief innovation officer Jacob Moody told TechCrunch. “I could not have gone into our warehouse and said, ‘Hey, this black box is going to start managing.’”
Instead, Moody pitched Netstock’s AI internally as a tool that warehouse managers could “either choose to use, or not use” — a process he describes as “eagerly, but cautiously dipping our toes” into AI.
Moody says it’s helping avoid mistakes, in part because it’s sifting through myriad reports his staff uses to make inventory decisions. He acknowledged the AI summaries of this info are not 100% accurate, but said it “helps create signals from the noise” quickly, especially during off-hours.
The “more profound” change Moody noticed is the software made some of Bargreen Ellingson’s less-senior warehouse staff “more effective.”
He highlighted an employee in one of Bargreen’s 25 warehouses who has worked there for two years. The employee has a high school diploma but no college degree. Training this employee to understand all of the inventory management tools and the forecasting information Bargreen uses to plan inventory levels will take time, he said.
“But he knows our customers, he knows what he’s putting on the truck every day, so for him, he can look at the system and have this prosaic AI-driven insight and very quickly understand whether it makes sense or doesn’t make sense,” he said. “So he feels empowered.”
Netstock co-founder Barry Kukkuk told TechCrunch that he understands the hesitancy around new technologies — especially because so many products are essentially mediocre chatbots attached to existing software.
He attributes the early success of Netstock’s Opportunity Engine to a few things. The company has more than a decade’s worth of data from working with retailers, distributors, and light manufacturers. That data is tightly protected to adhere to ISO frameworks, but it’s what powers the models that make the recommendations. (He said Netstock is using a combination of AI tech from the open source community and private companies.)
Each recommendation can be rated with a thumbs up or thumbs down, but the models also get reinforced by whether the customer takes the suggested action or not.
While that kind of reinforcement learning can lead to weird,sometimes harmfulresults when applied to things like social media, Kukkuk said he’s chasing different incentives.
“I don’t really care about eyeballs, you know?” he said. “Facebook and Instagram care about eyeballs, so they want you to look at their stuff. We care about: ‘what is the outcome for the customer?’”
Kukkuk’s wary of expanding those interactions due to the limitations of current generative AI tech. While it might make sense for a customer to converse with Netstock’s AI about why a recommendation is or isn’t useful, Kukkuk said that could ultimately lead to a breakdown in accuracy.
“It’s a tightrope to walk, because the more freedom you give the users, the more freedom you give a large language model to start hallucinating stuff,” he said.
This explains the Opportunity Engine’s placement in Netstock’s typical customer dashboard. The suggestions are prominent, but easily dismissed. Google Docs cramming 20 AI features down a user’s throat, this is not.
Moody said he appreciated that the AI isn’t in-your-face.
“We’re not letting the AI engine make any inventory decisions that a human hasn’t looked at and screened and said, ‘Yes, I agree with that,’” he said. “If and when we ever get to a point where they agree with 90% of the stuff that it’s suggesting, maybe we’ll take the next step and say ‘we’ll give you control now.’ But we’re not there yet.”
It’s a promising start at a time when many enterprise deployments of generative AIseem to go nowhere.
But if the tech gets better, Moody said he’s nevertheless worried about the implications.
“Personally, I’m afraid of what this means. I think there’s going to be a lot of change, and none of us is really sure what that’s going to look like at Bargreen,” he said. It could lead to there being fewer data science experts on staff, he suggested. But even if that means moving those employees out of the warehouse and into the corporate office, he said preserving knowledge is important.
Bargreen needs people who “deeply understand the theory and the philosophy and can rationalize how and why Netstock is making certain recommendations,” and to “make sure that we are not blindly going down” the wrong path, he said.",**Título:** Netstock: Innovación en IA para Facilitar la Gestión de Inventarios en Pequeñas Empresas,"**Título:** Netstock: Innovación en IA para Facilitar la Gestión de Inventarios en Pequeñas Empresas

**Resumen:**
En medio del debate sobre la viabilidad de la inteligencia artificial, las industrias de la cadena de suministro y logística están adoptando esta tecnología de manera tangible. A la vanguardia se encuentra Netstock, una empresa de gestión de inventarios fundada en 2009, que ha lanzado su herramienta innovadora llamada ""Opportunity Engine"". Este sistema, potenciado por IA generativa, se integra a los paneles de control de los clientes y utiliza datos de su software de planificación de recursos empresariales (ERP) para ofrecer recomendaciones en tiempo real.

Desde su lanzamiento, Netstock ha logrado proporcionar un millón de recomendaciones a sus clientes, afirmando que el 75% de ellos ha recibido sugerencias valoradas en $50,000 o más, lo que representa un ahorro significativo para estas pequeñas empresas. Sin embargo, la adopción de esta tecnología no ha estado exenta de reticencias, como lo ejemplifica Bargreen Ellingson, una compañía familiar de suministros de restaurantes. Su director de innovación, Jacob Moody, expresó inicialmente sus dudas sobre la integración de un sistema de IA, refiriéndose a la desconfianza hacia cambios abruptos. Para abordar esta inquietud, Moody presentó la herramienta de Netstock como una opción que los gerentes de almacén podrían elegir utilizar, permitiendo así una adopción más gradual y menos intimidante.

A pesar de que Moody reconoce que las recomendaciones de la IA no son infalibles, destaca el valor que esta herramienta aporta al filtrar información y facilitar la toma de decisiones, especialmente en momentos de alta carga laboral. Esta experiencia demuestra que, con el enfoque adecuado, la inteligencia artificial puede ser un aliado poderoso para las pequeñas empresas en su gestión operativa.

Seguí leyendo en este enlace: https://techcrunch.com/2025/08/28/how-a-16-year-old-company-is-easing-small-businesses-into-ai/","https://techcrunch.com/wp-content/uploads/2019/05/gettyimages-88514711.jpg?resize=1200,799"
TechCrunch,Anthropic users face a new choice – opt out or share your chats for AI training,https://techcrunch.com/2025/08/28/anthropic-users-face-a-new-choice-opt-out-or-share-your-data-for-ai-training/,"Anthropic is making some big changes to how it handles user data, requiring all Claude users to decide by September 28 whether they want their conversations used to train AI models. While the company directed us to itsblog poston the policy changes when asked about what prompted the move, we’ve formed some theories of our own.
But first, what’s changing: Previously, Anthropic didn’t use consumer chat data for model training. Now, the company wants to train its AI systems on user conversations and coding sessions, and it said it’s extending data retention to five years for those who don’t opt out.
That is a massive update. Previously, users of Anthropic’s consumer products were told that their prompts and conversation outputs would be automatically deleted from Anthropic’s back end within 30 days “unless legally or policy‑required to keep them longer” or their input was flagged as violating its policies, in which case a user’s inputs and outputs might be retained for up to two years.
By consumer, we mean the new policies apply to Claude Free, Pro, and Max users, including those using Claude Code. Business customers using Claude Gov, Claude for Work, Claude for Education, or API access will be unaffected, which is how OpenAI similarly protects enterprise customers from data training policies.
So why is this happening? In that post about the update, Anthropic frames the changes around user choice, saying that by not opting out, users will “help us improve model safety, making our systems for detecting harmful content more accurate and less likely to flag harmless conversations.” Users will “also help future Claude models improve at skills like coding, analysis, and reasoning, ultimately leading to better models for all users.”
In short, help us help you. But the full truth is probably a little less selfless.
Like every other large language model company, Anthropic needs data more than it needs people to have fuzzy feelings about its brand. Training AI models requires vast amounts of high-quality conversational data, and accessing millions of Claude interactions should provide exactly the kind of real-world content that can improve Anthropic’s competitive positioning against rivals like OpenAI and Google.
Beyond the competitive pressures of AI development, the changes would also seem to reflect broader industry shifts in data policies, as companies like Anthropic and OpenAI face increasing scrutiny over their data retention practices. OpenAI, for instance, is currently fighting a court order that forces the company to retain all consumer ChatGPT conversations indefinitely, including deleted chats, because of a lawsuit filed by The New York Times and other publishers.
In June, OpenAI COO Brad Lightcap called this “asweeping and unnecessary demand” that “fundamentally conflicts with the privacy commitments we have made to our users.” The court order affects ChatGPT Free, Plus, Pro, and Team users, though enterprise customers and those with Zero Data Retention agreements are still protected.
What’s alarming ishow much confusionall of these changing usage policies are creating for users, many of whom remain oblivious to them.
In fairness, everything is moving quickly now, so as the tech changes, privacy policies are bound to change. But many of these changes are fairly sweeping and mentioned only fleetingly amid the companies’ other news. (You wouldn’t think Tuesday’s policy changes for Anthropic users were very big news based on where the company placed this update on its press page.)
But many users don’t realize the guidelines to which they’ve agreed have changed because the design practically guarantees it. Most ChatGPT users keep clicking on “delete” toggles that aren’t technically deleting anything. Meanwhile, Anthropic’s implementation of its new policy follows a familiar pattern.
How so? New users will choose their preference during signup, but existing users face a pop-up with “Updates to Consumer Terms and Policies” in large text and a prominent black “Accept” button with a much tinier toggle switch for training permissions below in smaller print — and automatically set to “On.”
As observedearliertoday by The Verge, the design raises concerns that users might quickly click “Accept” without noticing they’re agreeing to data sharing.
Meanwhile, the stakes for user awareness couldn’t be higher. Privacy experts have long warned that the complexity surrounding AI makes meaningful user consent nearly unattainable. Under the Biden administration, the Federal Trade Commission even stepped in,warningthat AI companies risk enforcement action if they engage in “surreptitiously changing its terms of service or privacy policy, or burying a disclosure behind hyperlinks, in legalese, or in fine print.”
Whether the commission — now operating with justthreeof its five commissioners — still has its eye on these practices today is an open question, one we’ve put directly to the FTC.
",**Título: Anthropic Introduce Nuevas Políticas de Uso de Datos: Decisión Crucial para Usuarios de Claude**,"**Título: Anthropic Introduce Nuevas Políticas de Uso de Datos: Decisión Crucial para Usuarios de Claude**

Anthropic, la empresa de inteligencia artificial, ha anunciado importantes cambios en su gestión de datos de usuarios. A partir del 28 de septiembre, todos los usuarios de Claude deberán decidir si desean que sus conversaciones sean utilizadas para el entrenamiento de modelos de IA. Hasta ahora, la compañía no había empleado los datos de chat de los consumidores para este propósito, pero ahora apunta a integrar estas interacciones, lo que incluye sesiones de codificación, para mejorar sus sistemas.

La actualización implica un cambio significativo en las políticas de retención de datos. Anteriormente, los datos de los usuarios se eliminaban automáticamente del sistema de Anthropic en un plazo de 30 días, salvo excepciones legales o si se consideraban violaciones a las políticas de uso. Con la nueva política, los datos de quienes no opten por salir serán retenidos durante cinco años. Esta medida afecta exclusivamente a los usuarios de las versiones de consumo de Claude, como Claude Free, Pro y Max, mientras que los clientes empresariales permanecerán fuera de estas políticas.

Anthropic justifica este cambio como una oportunidad para que los usuarios ayuden a mejorar la seguridad del modelo, asegurando que la detección de contenido dañino sea más precisa. Sin embargo, detrás de esta narrativa, se encuentra una necesidad crítica de datos para el entrenamiento de modelos de IA, un recurso esencial para el desarrollo continuo de sus tecnologías. En un entorno donde la competencia por datos es feroz, estas decisiones reflejan la presión que enfrentan las empresas de IA para optimizar sus sistemas. 

Seguí leyendo en este enlace: https://techcrunch.com/2025/08/28/anthropic-users-face-a-new-choice-opt-out-or-share-your-data-for-ai-training/","https://techcrunch.com/wp-content/uploads/2024/12/Claude-ad-e1733259907871.jpg?resize=1200,800"
