fuente,titulo,url,contenido,titulo_sugerido,resumen,imagenTechCrunch,"OpenAI priced GPT-5 so low, it may spark a price war",https://techcrunch.com/2025/08/08/openai-priced-gpt-5-so-low-it-may-spark-a-price-war/,"OpenAI astounded the tech industry for the second time this week by launching itsnewest flagship model, GPT-5, just days after releasing twonew freely available modelsunder an open source license.
OpenAI CEO Sam Altman went so far as to call GPT-5 “the best model in the world.” That may be pride or hyperbole, as TechCrunch’s Maxwell Zeff reports that GPT-5 only slightly outperforms other leading AI models from Anthropic, Google DeepMind, and xAI on some key benchmarks, and slightly lags on others.
Still, it’s a model that performs well for a wide variety of uses, particularly coding. And, as Altman pointed out, one area where it is undoubtedly competing well is price. “Very happy with the pricing we are able to deliver!”he tweeted.
The top-level GPT-5 API costs $1.25 per 1 million tokens of input, and $10 per 1 million tokens for output (plus $0.125 per 1 million tokens for cached input). This pricing mirrors Google’s Gemini 2.5 Pro basicsubscription, which is also popular for coding-related tasks. Google, however,charges moreif inputs/outputs cross a heavy threshold of 200,000 prompts, meaning its most consumption-heavy customers end up paying more.
But OpenAI is really undercutting Anthropic’s Claude Opus 4.1, which starts at $15 per 1 million input tokens and $75 per 1 million output tokens. (Anthropic does, however, offer big discounts for prompt caching and batch processing — storing/reusing prompts and processing multiple requests together.)
Anthropic’s model has been extremely popular among programmers, both as a choicewithin popular coding assistant Cursorand for powering its own such assistant, Claude Code. (Note thatCursor offered GPT-5 as an optionminutes after it was announced.)
Developers who have had early access to GPT-5 are touting the pricing. Simon Willison, one of the developersfeatured in OpenAI’s launch video, writes in hisreview: “The pricing isaggressively competitivewith other providers.”
But GPT-5 is also priced competitively with GPT-4o. OthersideAI’s co-founder and CEO, Matt Shumer (maker of HyperWrite),writesthat GPT-5 “is cheaper than GPT-4o, which is fantastic. Intelligence per dollar continues to increase.”
Some on X called OpenAI’s fees for the model “a pricing killer,” while others on Hacker News areoffering similar praise.
Will competitors like Anthropic follow? Will Google — who undercut OpenAI on pricing before — get even more affordable? If so, we could be witnessing the start of a much-awaited LLM price war.
There’s no doubt a price war would be welcome. The underlying economics of vibe-coding tool providers, for instance, is pretty shaky because of the high and unpredictable fees they have to pay model makers,as TechCrunch’s Marina Temkin reports. And there are countless startups building on top of AI models as well.
Silicon Valley has been hoping that the LLM price-to-performance ratio will eventually improve, along with inference costs. But it seemed like such an equalization could be years away as the tech industry invests hundreds of billions to build data centers and infrastructure to support growing AI demand.
OpenAI itself has a$30 billion-per-year contractwith Oracle for capacity, when it only recently hitannual recurring revenue of $10 billion. Meanwhile, Meta plans tospend up to $72 billionon AI infrastructure in 2025, and Alphabet hasset aside$85 billion for capital expenditures in 2025, driven by AI needs. In the face of such enormous expenses, costs typically go one way: up.
Given such investments, it may be too soon for startupslooking at their rising model API billsto rejoice from OpenAI’s lone move to lower pricing.
Yet this week, OpenAI threw down the gauntlet to put pressure on prices not just once but twice. We’ll see if others follow.","**Título: OpenAI lanza GPT-5 a precios competitivos, desata posibles guerras de precios en la IA**","**Título: OpenAI lanza GPT-5 a precios competitivos, desata posibles guerras de precios en la IA**

OpenAI ha sorprendido nuevamente al sector tecnológico con el lanzamiento de su último modelo insignia, GPT-5, apenas días después de presentar dos nuevos modelos de acceso gratuito bajo licencia de código abierto. El CEO de OpenAI, Sam Altman, afirmó que GPT-5 es ""el mejor modelo del mundo"", aunque algunos informes sugieren que su rendimiento apenas supera al de otros modelos líderes como los de Anthropic, Google DeepMind y xAI en ciertos benchmarks.

GPT-5 se destaca especialmente en tareas de programación, y Altman enfatizó que su modelo tiene una ventaja significativa en términos de precios. La API de GPT-5 se ofrece a un costo de $1.25 por cada millón de tokens de entrada y $10 por cada millón de tokens de salida, además de $0.125 por cada millón de tokens para entradas almacenadas. Esta estructura tarifaria es similar a la del popular modelo Gemini 2.5 Pro de Google, aunque Google aplica tarifas más altas cuando se superan ciertos umbrales de uso.

Lo que realmente posiciona a OpenAI en una ventaja competitiva es su precio en comparación con el modelo Claude Opus 4.1 de Anthropic, que comienza en $15 por millón de tokens de entrada y $75 por millón de salida. A pesar de que Anthropic ofrece descuentos por almacenamiento de prompts y procesamiento por lotes, la diferencia de precios puede atraer a muchos desarrolladores.

Los primeros usuarios de GPT-5 han elogiado su relación calidad-precio. Simon Willison, uno de los desarrolladores que participó en el lanzamiento, calificó la estrategia de precios de OpenAI como ""agresivamente competitiva"". Este movimiento podría desencadenar una guerra de precios en el sector de la inteligencia artificial, beneficiando a desarrolladores y empresas por igual.

Seguí leyendo en este enlace: https://techcrunch.com/2025/08/08/openai-priced-gpt-5-so-low-it-may-spark-a-price-war/","https://techcrunch.com/wp-content/uploads/2025/04/GettyImages-2198353376.jpg?resize=1200,800"
TechCrunch,Parents sue OpenAI over ChatGPT’s role in son’s suicide,https://techcrunch.com/2025/08/26/parents-sue-openai-over-chatgpts-role-in-sons-suicide/,"Before 16-year-old Adam Raine died by suicide, he had spent months consulting ChatGPT about his plans to end his life. Now, his parents are filing the first known wrongful death lawsuit against OpenAI, The New York Timesreports.
Many consumer-facing AI chatbots are programmed to activate safety features if a user expresses intent to harm themselves or others. Butresearchhas shown that these safeguards are far from foolproof.
In Raine’s case, while using a paid version of ChatGPT-4o, the AI often encouraged him to seek professional help or contact a help line. However, he was able to bypass these guardrails by telling ChatGPT that he was asking about methods of suicide for a fictional story he was writing.
OpenAI has addressed these shortcomings on its blog. “As the world adapts to this new technology, we feel a deep responsibility to help those who need it most,” the postreads. “We are continuously improving how our models respond in sensitive interactions.”
Still, the company acknowledged the limitations of the existing safety training for large models. “Our safeguards work more reliably in common, short exchanges,” the post continues. “We have learned over time that these safeguards can sometimes be less reliable in long interactions: as the back-and-forth grows, parts of the model’s safety training may degrade.”
These issues are not unique to OpenAI. Character.AI, another AI chatbot maker, is alsofacing a lawsuitover its role in a teenager’s suicide. LLM-powered chatbots have also been linked to cases ofAI-related delusions, which existing safeguards have struggled to detect.
",**Título: Demandas contra OpenAI: La controversia por el uso de ChatGPT en casos de suicidio juvenil**,"**Título: Demandas contra OpenAI: La controversia por el uso de ChatGPT en casos de suicidio juvenil**

Un trágico suceso ha llevado a los padres de Adam Raine, un adolescente de 16 años que se quitó la vida, a presentar una demanda por homicidio culposo contra OpenAI, marcando un hito en la responsabilidad legal de las empresas de inteligencia artificial. Según informes, Adam había estado utilizando ChatGPT durante meses para discutir sus pensamientos suicidas. A pesar de que el chatbot, en su versión de pago, a menudo le sugería buscar ayuda profesional, el joven logró eludir los mecanismos de seguridad al presentar sus inquietudes como parte de una narrativa ficticia.

Los chatbots de inteligencia artificial, como los desarrollados por OpenAI, están diseñados para activar medidas de seguridad si un usuario expresa intenciones autolesivas o de daño hacia otros. Sin embargo, investigaciones recientes han revelado que estas salvaguardias son ineficaces en muchos casos. La propia OpenAI ha reconocido las limitaciones de su sistema de entrenamiento para manejar interacciones sensibles, señalando que los mecanismos de seguridad tienden a funcionar mejor en intercambios cortos y comunes, mientras que en diálogos prolongados pueden perder efectividad. 

Este caso no es aislado; otras plataformas de chat AI, como Character.AI, también enfrentan litigios relacionados con suicidios de adolescentes. Adicionalmente, ha habido informes que vinculan chatbots impulsados por modelos de lenguaje con episodios de delirios, evidenciando la dificultad de los sistemas actuales para detectar y responder adecuadamente a situaciones de riesgo.

La tragedia de Adam Raine subraya la necesidad urgente de revisar y mejorar la seguridad en las interacciones de inteligencia artificial, así como la responsabilidad de las empresas tecnológicas en la protección de sus usuarios más vulnerables.

Seguí leyendo en este enlace: https://techcrunch.com/2025/08/26/parents-sue-openai-over-chatgpts-role-in-sons-suicide/",https://techcrunch.com/wp-content/uploads/2025/01/GettyImages-2191707579.jpg?w=1024
TechCrunch,"Nvidia unveils new Cosmos world models, infra for robotics and physical uses",https://techcrunch.com/2025/08/11/nvidia-unveils-new-cosmos-world-models-other-infra-for-physical-applications-of-ai/,"Nvidia on Monday unveiled a set of new world AI models, libraries, and other infrastructure for robotics developers, most notable of which is Cosmos Reason, a 7-billion-parameter “reasoning” vision language model for physical AI applications and robots.
Also joining the existing batch ofCosmos world modelsare Cosmos Transfer-2, which can accelerate synthetic data generation from 3D simulation scenes or spatial control inputs, and a distilled version of Cosmos Transfers that is more optimized for speed.
During its announcement at the SIGGRAPH conference on Monday, Nvidia noted that these models are meant to be used to create synthetic text, image, and video datasets for training robots and AI agents.
Cosmos Reason, per Nvidia, allows robots and AI agents to “reason” thanks to its memory and physics understanding, which lets it “serve as a planning model to reason what steps an embodied agent might take next.” The company says it can be used for data curation, robot planning, and video analytics.
The company also unveiled new neural reconstruction libraries, which includes one for a rendering technique that lets developers simulate the real world in 3D using sensor data. This rendering capability is also being integrated into open source simulator CARLA, a popular developer platform. There’s even an update to the Omniverse software development kit.
There are new servers for robotics workflows, too. The Nvidia RTX Pro Blackwell Server offers a single architecture for robotic development workloads, while Nvidia DGX Cloud is a cloud-based management platform.
These announcements come as the semiconductor giant is pushing further into robotics as it looks toward the next big use case for its AI GPUs beyond AI data centers.
We’re always looking to evolve, and by providing some insight into your perspective and feedback into TechCrunch, you can help us!Fill out this survey to let us know how we’re doing.",**Título:** Nvidia presenta Cosmos: Nuevos modelos de IA para la robótica y aplicaciones físicas,"**Título:** Nvidia presenta Cosmos: Nuevos modelos de IA para la robótica y aplicaciones físicas

**Resumen:**  
En el marco de la conferencia SIGGRAPH, Nvidia ha anunciado una serie de innovaciones en inteligencia artificial diseñadas específicamente para desarrolladores de robótica. Destacándose entre estas novedades se encuentra Cosmos Reason, un modelo de lenguaje visual de 7 mil millones de parámetros, capaz de ""razonar"" y entender conceptos de memoria y física. Este modelo tiene como objetivo facilitar la planificación y toma de decisiones en robots y agentes de IA, permitiéndoles anticipar los pasos que deben seguir en diversas tareas físicas.

Además, Nvidia ha introducido Cosmos Transfer-2, que optimiza la generación de datos sintéticos a partir de escenas de simulación 3D. Este avance se complementa con una versión destilada de la transferencia de Cosmos, que mejora la velocidad de procesamiento. Estos modelos están destinados a crear conjuntos de datos sintéticos de texto, imagen y video, esenciales para el entrenamiento de sistemas robóticos.

La compañía también reveló nuevas bibliotecas de reconstrucción neural, que incluyen técnicas de renderizado para simular el mundo real en 3D utilizando datos de sensores. Esta capacidad de renderizado se integrará en CARLA, un simulador de código abierto muy utilizado por desarrolladores. Además, se presentó el servidor Nvidia RTX Pro Blackwell, diseñado para flujos de trabajo en robótica, y Nvidia DGX Cloud, una plataforma de gestión en la nube.

Estas iniciativas marcan un paso significativo de Nvidia hacia el desarrollo de aplicaciones robóticas, ampliando el uso de sus GPUs más allá de los centros de datos dedicados a la IA.

Seguí leyendo en este enlace: https://techcrunch.com/2025/08/11/nvidia-unveils-new-cosmos-world-models-other-infra-for-physical-applications-of-ai/","https://techcrunch.com/wp-content/uploads/2025/03/GettyImages-2205761844.jpg?resize=1200,846"
TechCrunch,"These 20- and 22-year-olds raised $5M from YC, General Catalyst to study online behavior using vision AI",https://techcrunch.com/2025/09/03/these-20-and-22-year-olds-raised-5m-from-yc-general-catalyst-to-study-online-behavior-using-vision-ai/,"Amogh Chaturvediis running on little sleep but plenty of conviction at 6 a.m. He’s groggy, apologetic for rescheduling, and still reeling from a recent scare involving a family member and an electric scooter.
Within minutes, though, the 20-year-old Stanford dropout snaps into focus, walking me through how he and his co-founders sold one startup at 19, landed in Y Combinator, and raised $5 million for their next company,Human Behavior.
Launched just a few months ago, Human Behavior is betting that vision AI can do what analytics tools like Mixpanel and PostHog have struggled with: give companies a real understanding of how people use their products, including why they convert or churn.
Instead of relying on manually tagged events or clickstream data, Human Behavior claims its AI watches real user session replays and generates insights, answering product teams’ most pressing questions without hours of instrumenting code.
The 4-month-old YC startup closed its $5 million seed round in just two days (which is becoming a norm for current YC companies), with backers including General Catalyst, Paul Graham, Vercel Ventures, and Y Combinator.
“We could’ve done the financial engineering game because we got more offers with higher valuations, but we didn’t want that,” said the CEO.
Chaturvedi met his co-founders,Skyler JiandChirag Kawediya, both 22, at a hacker house he organized in 2023 as an excuse to live and build with friends after his freshman year at Stanford.
Their first startup, Dough, was an e-commerce accounting tool they bootstrapped. Like Chaturvedi, Ji dropped out of college (leaving Berkeley) while Kawediya went on to graduate.
Although YC was initially skeptical about Dough’s market potential, the team was admitted into the accelerator’s spring batch this year on the assumption they would eventually pivot, Chaturvedi says. They did so almost immediately, after speaking with every customer and inquiring about any other problems they faced.
The feedback was consistent: While Dough could show which products were selling or not, the customers wanted to know why. Answering that required analytics powered by behavioral data, not just accounting reports.
With this new direction, the team sold Dough for six figures to Employer.com,the same company that bought Bench, and went all-in on Human Behavior.
Kawediya explains that companies using traditional analytics often need engineers to set up event trackers for every button and click, burning hours, sometimes weeks, of engineering time.
For a fast-moving startup, that’s far from ideal. “Even once you have that data, you’re still stuck with the bigger question of how users actually interact with your product so you can make it better,” he says.
Session replays aren’t new, but until recently, computer vision models weren’t accurate enough to parse them at scale. Now they are, and Human Behavior is doing so to summarize and segment thousands of hours of footage. “Why spend hours writing code to track clicks when we can just watch the video?” Ji adds.
Today, Human Behavior’s customers — mostly fast-moving Series A and B startups — get daily summary emails highlighting which features were used, which bugs appeared, and which users churned.
The founders call session replays an “untapped goldmine.” Right now, Human Behavior helps teams understand users and squash bugs. Over time, the same dataset could power automated QA and embedded IT support. Their ambition is to make Human Behavior the Datadog of session replay, spinning out dozens of products from the same core data.
Building with new technology from the ground up is how the founders believe they’ll take on more established players like Mixpanel and PostHog. “For some of these companies, it might be difficult to replicate what we have because their architecture can’t support the shift without starting over,” remarked Chaturvedi.",**Título:** Jóvenes emprendedores levantan $5 millones para transformar el análisis del comportamiento en línea con IA visual,"**Título:** Jóvenes emprendedores levantan $5 millones para transformar el análisis del comportamiento en línea con IA visual

**Resumen:**  
Amogh Chaturvedi, un joven de 20 años y exalumno de Stanford, se encuentra al mando de una nueva startup llamada Human Behavior, que promete revolucionar la forma en que las empresas comprenden el uso de sus productos a través de la inteligencia artificial visual. Fundada junto a sus coetáneos, Skyler Ji y Chirag Kawediya, ambos de 22 años, la empresa ha recaudado recientemente $5 millones en una ronda de financiamiento semilla, cerrada en tan solo dos días. Este capital proviene de inversores destacados como Y Combinator, General Catalyst y Vercel Ventures.

A diferencia de las herramientas de análisis tradicionales, que dependen de datos etiquetados manualmente y flujos de clics, Human Behavior utiliza IA para analizar sesiones de usuario reales, generando información valiosa sobre por qué los usuarios convierten o abandonan los productos. Esta metodología no solo promete optimizar el proceso de obtención de datos, sino que también permite a los equipos de producto responder a preguntas críticas sin la necesidad de implementar horas de codificación.

La trayectoria de Chaturvedi y su equipo comenzó con su primer emprendimiento, Dough, una herramienta de contabilidad para e-commerce, que fue finalmente vendida. Aunque Y Combinator mostró escepticismo inicial sobre el potencial de mercado de Dough, el equipo pivotó rápidamente hacia su nueva propuesta tras obtener retroalimentación directa de los clientes.

La visión de Human Behavior es clara: ofrecer a las empresas una comprensión más profunda y precisa del comportamiento del usuario, haciendo que el análisis de datos sea más accesible y eficiente. 

Seguí leyendo en este enlace: https://techcrunch.com/2025/09/03/these-20-and-22-year-olds-raised-5m-from-yc-general-catalyst-to-study-online-behavior-using-vision-ai/","https://techcrunch.com/wp-content/uploads/2025/09/6dda7ae0-1b20-424c-8155-ec79427d42f4.jpeg?resize=1200,864"
TechCrunch,Karen Hao on the making of a $90B AI empire,https://techcrunch.com/podcast/karen-hao-on-the-making-of-a-90b-ai-empire/,"Karen Hao, the bestselling author of “Empire of AI,” has watched OpenAI go from a nonprofit “laughingstock” to a $90 billion powerhouse chasing artificial general intelligence at breakneck speeds. Hao, who first profiled the company back in 2020, says early visions of building AI “for humanity’s benefit” were quickly overtaken by a familiar Silicon Valley mindset: Move fast, break things, and let scale be the measure of success.
This week, Hao joined TechCrunch’sEquitypodcast to unpack the direction the AI boom is going and who’s paying the price. Hao argues that, like historical empires, today’s AI giants rely on resource hoarding and exploitative labor to amass political and economic power, and they’re doing so at the expense of the environment. For investors and founders, it’s a clear signal that AI’s current path carries real risks, and that there’s room to build a better model.
Listen to the full episode to hear:
Equity will be back Friday with our weekly news roundup, so stay tuned.
Equity is TechCrunch’s flagship podcast, produced by Theresa Loconsolo, and posts every Wednesday and Friday.
Subscribe to us onApple Podcasts,Overcast,Spotifyand all the casts. You also can follow Equity onXandThreads, at @EquityPod.",**Título: La evolución de OpenAI: de la risa a un imperio de $90 mil millones en inteligencia artificial**,"**Título: La evolución de OpenAI: de la risa a un imperio de $90 mil millones en inteligencia artificial**

En una reciente aparición en el podcast Equity de TechCrunch, Karen Hao, autora del bestseller ""Empire of AI"", analizó la metamorfosis de OpenAI, que ha pasado de ser una organización sin fines de lucro considerada un ""objeto de risa"" a convertirse en un coloso valorado en $90 mil millones, con la ambición de alcanzar la inteligencia general artificial. Hao, quien documentó el surgimiento de la compañía en 2020, observa que las intenciones iniciales de desarrollar inteligencia artificial para el beneficio de la humanidad han sido suplantadas por una mentalidad típica del Silicon Valley: ""Avanza rápido, rompe cosas y deja que la escala sea el indicador del éxito"".

La autora plantea que, al igual que los imperios históricos, los gigantes de la IA actuales dependen de la acumulación de recursos y del trabajo explotador para consolidar su poder político y económico, a menudo a costa del medio ambiente. Esta realidad presenta a inversores y emprendedores una señal clara: el rumbo actual de la inteligencia artificial conlleva riesgos significativos y abre la puerta a la creación de modelos más sostenibles y éticos.

Hao advierte que el auge de la IA no solo plantea desafíos técnicos, sino que también exige una reflexión crítica sobre sus implicancias sociales y medioambientales. En este contexto, la conversación sobre el futuro de la inteligencia artificial se vuelve más relevante que nunca, resaltando la necesidad de un enfoque más responsable en su desarrollo y aplicación.

Seguí leyendo en este enlace: https://techcrunch.com/podcast/karen-hao-on-the-making-of-a-90b-ai-empire/","https://techcrunch.com/wp-content/uploads/2025/09/KarenHao-BW.png?resize=1200,900"
