fuente,titulo,url,contenido,titulo_sugerido,resumen,imagenTechCrunch,"Orchard Robotics, founded by a Thiel fellow Cornell dropout, raises $22M for farm vision AI",https://techcrunch.com/2025/09/03/orchard-robotics-founded-by-a-thiel-fellow-cornell-dropout-raises-22m-for-farm-vision-ai/,"Inspired by his grandparents, who were apple farmers in China, Charlie Wu got the idea to apply technology to agriculture while studying computer science at Cornell University, a top agriculture school.
“I got to meet fruit professors who are the best in the world at what they do,” Wu told TechCrunch. “Through talking to them, I realized even the largest farms in the nation basicallyhave no idea what is actually growing out in their fields.”
He dropped out of Cornell, became a Thiel fellow, and in 2022 began buildingOrchard Robotics, a startup that uses cameras and AI to help fruit growers manage their crops more precisely.
On Wednesday, Orchard Robotics announced that it raised a $22 million Series A funding led by Quiet Capital and Shine Capital, and with participation from returning investors, including General Catalyst and Contrary.
Although the idea of using computer vision for specialty crops isn’t new, Wu says that the largest farms in the U.S. still rely on manual sampling to make critical decisions about farm operations.
Since farmers inspect only a small percentage of their crops, their estimations of how many healthy fruits they have on their vineyard or orchard can be extremely imprecise.
“If you don’t know what you’re growing in the field, you don’t know how much chemical to apply to it. You don’t know how many workers to hire to harvest it. You don’t know what you can actually sell and market,” Wu said.
Orchard’s small camera attaches to tractors or farm vehicles, collecting ultra-high-resolution images about fruit health as the operator drives through the field. Those images are then analyzed by AI for fruit size, color, and health.
The data is then uploaded into Orchard’s cloud-based software, which acts as a central record for making decisions such as the vines or trees that may need extra fertilization, pruning, or thinning.
Orchard is already in use in some of the country’s largest apple and grape farms, and the startup recently began to offer its technology to blueberries, cherries, almonds, pistachios, citrus, and strawberry growers.
The company is not alone in its use of tractor-mounted cameras to leverage AI for specialty crop image analysis. Orchard’s direct competitors include Bloomfield Robotics, which last year wasacquiredby farm equipment manufacturer Kubota, as well as seed-stage startups Vivid Robotics and Green Atlas.
Wu admits the existing market for fruit and vegetable data is only $1.5 billion, but he believes that future AI advancements will allow the technology to make autonomous decisions, expanding Orchard’s product offerings.
He hopes Orchard’s evolution mirrors that of Flock Safety, a public safety startup now valued at $7.5 billion, which over the past eight years has expanded from simply collecting license plate information to a range of other products, including gunshot detection and video surveillance.
“Our ambition is to be a lot more than just collecting data,” Wu said. “We want to collect the data, then build an operating system on top of the data, and then eventually own all the workflows in the farm, and that’s going to have the potential to expand our market by quite a bit.”",**Título: Orchard Robotics: La Revolución de la Agricultura de Precisión con IA y $22 Millones en Financiamiento**,"**Título: Orchard Robotics: La Revolución de la Agricultura de Precisión con IA y $22 Millones en Financiamiento**

Orchard Robotics, una startup innovadora creada por Charlie Wu, un exalumno de Cornell y becario de Thiel, ha captado la atención del sector agrícola tras asegurar $22 millones en una ronda de financiamiento Serie A. La empresa, que se especializa en la aplicación de inteligencia artificial y visión por computadora para optimizar la gestión de cultivos frutales, busca transformar la manera en que los agricultores supervisan y manejan sus cosechas.

La inspiración de Wu proviene de sus abuelos, quienes fueron agricultores de manzanas en China. Durante su tiempo en Cornell, observó que incluso las fincas más grandes de Estados Unidos carecen de un conocimiento preciso sobre lo que realmente crece en sus campos. A pesar de que la tecnología de visión por computadora no es una novedad en la agricultura, la mayoría de los agricultores aún dependen de métodos manuales de muestreo, lo que resulta en estimaciones inexactas sobre la salud de sus cultivos.

El sistema de Orchard Robotics consiste en una pequeña cámara que se acopla a tractores y vehículos agrícolas, capturando imágenes de alta resolución sobre la salud de los frutos mientras se desplazan por el terreno. Estas imágenes son analizadas por inteligencia artificial, la cual evalúa el tamaño, color y estado de los frutos. La información recolectada se almacena en un software basado en la nube, facilitando decisiones críticas como la fertilización, poda o el número de trabajadores necesarios para la cosecha.

Actualmente, Orchard Robotics está implementada en algunas de las fincas de manzanas y uvas más grandes del país, marcando un avance significativo en la agricultura de precisión.

Seguí leyendo en este enlace: https://techcrunch.com/2025/09/03/orchard-robotics-founded-by-a-thiel-fellow-cornell-dropout-raises-22m-for-farm-vision-ai/","https://techcrunch.com/wp-content/uploads/2025/09/CameraSystem_Picture.png?resize=1200,1118"
TechCrunch,"Mistral, the French AI giant, is reportedly on the cusp of securing a $14B valuation",https://techcrunch.com/2025/09/03/mistral-the-french-ai-giant-is-reportedly-on-the-cusp-of-securing-a-14-billion-valuation/,"French AI startupMistral AI is finalizing a €2 billion investmentat a post-money valuation of $14 billion, reports Bloomberg, positioning the company as one of Europe’s most valuable tech startups. Thetwo-year-old OpenAI rival, founded by former DeepMind and Meta researchers, develops open source language models and Le Chat, its AI chatbot built for European audiences.
Mistral isn’t commenting on the report, but the round would represent Mistral’s first major raise since June 2024, when it was valued at €5.8 billion. The company has previously raised over €1 billion from prominent investors, including Andreessen Horowitz and General Catalyst.
The investment comes as European AI startups gain unprecedented momentum. European AI companies secured 55% more year-on-year investment in Q1 2025, according to Dealroom,with 12 European startups achieving unicorn statusin the first half of the year. Also leading this surge is Sweden’s Lovable, an AI coding platform that reached a$1.8 billion valuationin July just eight months after its launch.",**Título: Mistral AI: La Startup Francesa de IA en la Ruta hacia una Valoración de 14 Mil Millones de Dólares**,"**Título: Mistral AI: La Startup Francesa de IA en la Ruta hacia una Valoración de 14 Mil Millones de Dólares**

Mistral AI, una startup francesa emergente en el ámbito de la inteligencia artificial, se encuentra en la etapa final para asegurar una inversión de 2.000 millones de euros, lo que la posicionaría con una valoración post-inversión de 14.000 millones de dólares. Este hito marcaría a Mistral como una de las startups tecnológicas más valiosas de Europa, consolidando su lugar en un sector en rápida expansión. Fundada hace apenas dos años por ex-investigadores de DeepMind y Meta, Mistral se especializa en el desarrollo de modelos de lenguaje de código abierto y en la creación de Le Chat, un chatbot de inteligencia artificial diseñado específicamente para audiencias europeas.

A pesar de que la empresa no ha realizado comentarios oficiales sobre el informe, esta ronda de financiación representa su primera gran recaudación desde junio de 2024, cuando su valoración se situaba en 5.800 millones de euros. Hasta la fecha, Mistral ha logrado recaudar más de 1.000 millones de euros de inversores de renombre, incluidos Andreessen Horowitz y General Catalyst.

Este movimiento se produce en un contexto donde las startups de inteligencia artificial en Europa están experimentando un auge sin precedentes. Según Dealroom, las empresas de IA del continente aseguraron un 55% más de inversión en comparación con el año anterior en el primer trimestre de 2025, con 12 startups alcanzando el estatus de unicornio en la primera mitad del año. Un ejemplo notable es Lovable, una plataforma de codificación de IA de Suecia, que alcanzó una valoración de 1.800 millones de dólares solo ocho meses después de su lanzamiento.

Seguí leyendo en este enlace: https://techcrunch.com/2025/09/03/mistral-the-french-ai-giant-is-reportedly-on-the-cusp-of-securing-a-14-billion-valuation/","https://techcrunch.com/wp-content/uploads/2025/02/GettyImages-2193522095.jpg?resize=1200,800"
TechCrunch,"Billionaire Ambani taps Google, Meta to build India’s AI backbone",https://techcrunch.com/2025/08/29/billionaire-ambani-taps-google-meta-to-build-indias-ai-backbone/,"Mukesh Ambani, India’s richest man and chairman of Reliance Industries, has unveiled an ambitious plan to build the country’s AI backbone through a new subsidiary — starting with strategic partnerships with Google Cloud and Meta.
At the company’s 48th annual general meeting on Friday, Ambani launched a new venture called Reliance Intelligence, a subsidiary of Reliance Industries. The new venture aims to create a national-scale AI infrastructure, including enterprise tools and services for a variety of sectors. The move comes as India looks to catch up in the global AI race long dominated by the U.S. and China.
“Reliance Intelligence will create a home for world-class researchers, engineers, designers, and product builders, combining the speed of research with the rigor of engineering,” Ambani said in his keynote, “so that ideas become innovations and applications, providing solutions to India and the world.”
To kick things off, Reliance has partnered with Google —one of its major tech partners— to build a dedicated AI cloud infrastructure in India. The network will start with a major data center in Jamnagar, a city in the western state of Gujarat.
The dedicated cloud region will enable Reliance to offer AI-focused services to businesses of all sizes, developers, and government bodies, utilizing Jio’s network and its own energy assets to support large-scale deployments, the companies said in their joint statement.
“As Reliance’s largest public cloud partner, Google Cloud is not only powering the company’s mission-critical workloads, but we are also innovating with you on advanced AI initiatives,” Google CEO Sundar Pichai said in a video message during the company’s virtual AGM. “This is only the beginning.”
Google did not immediately respond to a query about the financial terms of the partnership.
Reliance has also announced a joint venture with Meta, another of its major tech investors, to build and scale enterprise AI solutions for customers in India and select international markets. Under the agreement, Reliance and Meta have committed a combined investment of ₹8.55 billion (approximately $100 million) under a 70/30 ownership split, respectively.
The partnership will offer Meta’s Llama-based enterprise AI platform-as-a-service, allowing businesses to customize, deploy, and manage generative AI models for use cases across sales, marketing, IT, customer service, and finance. The joint venture will also provide a suite of pre-configured AI solutions, the companies said.
Reliance’s collaboration comes just weeks after Meta restructured its AI ventures intoa new Superintelligence Labs, fueled by an expensive string of top AI hires. (Meta isreportedly pausing the hiring spreeafter concern from shareholders.)
“Through this joint venture, we’re putting Meta’s Llama models into real-world use,” Meta CEO Mark Zuckerberg said in a prepared statement.
The transaction is subject to customary regulatory approvals and is expected to close in the fourth quarter of 2025.
Reliance is planning to expand beyond India and take its flagship subsidiary Reliance Jio Platforms to international markets, Ambani said. Ambani also revealed that Jio aims to file for an initial public offering in the first half of 2026, followingmuch anticipation and initial delays.
Reliance is alsoreportedly eyeing a partnership with OpenAI, which recently introduced itssub-$5 ChatGPT subscriptionin India and announced its plans toset up an office in New Delhi later this year. The details of the partnership are likely to be announced during Sam Altman’s upcoming visit to India next month, two people familiar with the matter told TechCrunch.
Reliance and OpenAI did not immediately respond to a request for comment.
Earlier this year, Reliance’s arch-rival Bharti Airtel, the country’s second-largest telco after Jio,partnered with Perplexityto offer more than 360 million Airtel subscribers access to Perplexity Pro for 12 months.
Reliance hasalready partnered with Microsoftto offer its Azure cloud platform to Indian enterprises. The company also offers JioAICloud, a consumer-focused service that provides 100GB of free storage. The consumer cloud service has been used by 40 million users and is updated with voice search support and an AI Create Hub to turn photos into AI-powered reels, collages, and promo videos, the company announced at its annual general meeting.
Reliance also showcased its AI-based smart glasses, JioFrames, as its answer to Snap’s Spectacles and Ray-Ban Meta glasses. Similarly, the company is integrating AI into its streaming platform, JioHotstar, which has attracted over 600 million users and 300 million paying subscribers in the three months since its launch in February.
The new AI features include “Riya” voice assistant and content translation into Indian languages using AI-voice cloning and lip-syncing tech.
",**Título: Mukesh Ambani y la construcción de la infraestructura de IA en India con Google y Meta**,"**Título: Mukesh Ambani y la construcción de la infraestructura de IA en India con Google y Meta**

Mukesh Ambani, el hombre más rico de India y presidente de Reliance Industries, ha presentado un ambicioso plan para establecer la infraestructura de inteligencia artificial (IA) del país a través de una nueva subsidiaria llamada Reliance Intelligence. Durante la 48ª reunión anual de accionistas de la compañía, Ambani destacó que esta iniciativa busca posicionar a India en un lugar competitivo en la carrera global de IA, dominada hasta ahora por Estados Unidos y China.

Reliance Intelligence se propone crear una infraestructura de IA a escala nacional, ofreciendo herramientas y servicios empresariales para diversas industrias. Ambani enfatizó la importancia de combinar la velocidad de la investigación con la rigurosidad de la ingeniería, con el objetivo de transformar ideas en innovaciones aplicables que beneficien tanto a India como al mundo.

Para iniciar este proyecto, Reliance ha establecido una colaboración estratégica con Google Cloud para desarrollar una infraestructura de nube de IA dedicada en India. Este esfuerzo comenzará con la construcción de un importante centro de datos en Jamnagar, Gujarat, que permitirá a Reliance ofrecer servicios de IA a empresas de todos los tamaños, así como a desarrolladores y entidades gubernamentales. Sundar Pichai, CEO de Google, subrayó el compromiso de la compañía de innovar junto a Reliance en iniciativas avanzadas de IA.

Además, Reliance ha anunciado una joint venture con Meta, otro importante inversor tecnológico, para crear y escalar soluciones de IA empresarial orientadas a clientes en India y mercados seleccionados. Esta sinergia entre gigantes tecnológicos y Reliance marca un paso significativo hacia la consolidación de una robusta infraestructura de IA en el país.

Seguí leyendo en este enlace: https://techcrunch.com/2025/08/29/billionaire-ambani-taps-google-meta-to-build-indias-ai-backbone/","https://techcrunch.com/wp-content/uploads/2020/06/GettyImages-1161221564.jpg?resize=1200,800"
TechCrunch,OpenAI co-founder calls for AI labs to safety-test rival models,https://techcrunch.com/2025/08/27/openai-co-founder-calls-for-ai-labs-to-safety-test-rival-models/,"OpenAI and Anthropic, two of the world’s leading AI labs, briefly opened up their closely guarded AI models to allow for joint safety testing — a rare cross-lab collaboration at a time of fierce competition. The effort aimed to surface blind spots in each company’s internal evaluations and demonstrate how leading AI companies can work together on safety and alignment work in the future.
In an interview with TechCrunch, OpenAI co-founder Wojciech Zaremba said this kind of collaboration is increasingly important now that AI is entering a “consequential” stage of development, where AI models are used by millions of people every day.
“There’s a broader question of how the industry sets a standard for safety and collaboration, despite the billions of dollars invested, as well as the war for talent, users, and the best products,” said Zaremba.
The joint safety research, published Wednesday bybothcompanies, arrives amid an arms race among leading AI labs like OpenAI and Anthropic, wherebillion-dollar data center betsand$100 million compensation packagesfor top researchers have become table stakes. Some experts warn that the intensity of product competition could pressure companies to cut corners on safety in the rush to build more powerful systems.
To make this research possible, OpenAI and Anthropic granted each other special API access to versions of their AI models with fewer safeguards (OpenAI notes that GPT-5 was not tested because it hadn’t been released yet). Shortly after the research was conducted, however, Anthropic revokedthe API access of another team at OpenAI. At the time, Anthropic claimed that OpenAI violated its terms of service, which prohibits using Claude to improve competing products.
Zaremba says the events were unrelated and that he expects competition to stay fierce even as AI safety teams try to work together. Nicholas Carlini, a safety researcher with Anthropic, tells TechCrunch that he would like to continue allowing OpenAI safety researchers to access Claude models in the future.
“We want to increase collaboration wherever it’s possible across the safety frontier, and try to make this something that happens more regularly,” said Carlini.
One of the most stark findings in the study relates to hallucination testing. Anthropic’s Claude Opus 4 and Sonnet 4 models refused to answer up to 70% of questions when they were unsure of the correct answer, instead offering responses like, “I don’t have reliable information.” Meanwhile, OpenAI’s o3 and o4-mini models refuse to answer questions far less, but showed muchhigher hallucination rates, attempting to answer questions when they didn’t have enough information.
Zaremba says the right balance is likely somewhere in the middle — OpenAI’s models should refuse to answer more questions, while Anthropic’s models should probably attempt to offer more answers.
Sycophancy, the tendency for AI models to reinforce negative behavior in users to please them, has emerged as one of the most pressingsafety concernsaround AI models.
In Anthropic’s research report, the company identified examples of “extreme” sycophancy in GPT-4.1 and Claude Opus 4 — in which the models initially pushed back on psychotic or manic behavior, but later validated some concerning decisions. In other AI models from OpenAI and Anthropic, researchers observed lower levels of sycophancy.
On Tuesday, parents of a 16-year-old boy, Adam Raine, filed alawsuitagainst OpenAI, claiming that ChatGPT (specifically a version powered by GPT-4o) offered their son advice that aided in his suicide, rather than pushing back on his suicidal thoughts. The lawsuit suggests this may be the latestexampleof AI chatbot sycophancy contributing to tragic outcomes.
“It’s hard to imagine how difficult this is to their family,” said Zaremba when asked about the incident. “It would be a sad story if we build AI that solves all these complex PhD level problems, invents new science, and at the same time, we have people with mental health problems as a consequence of interacting with it. This is a dystopian future that I’m not excited about.”
In ablog post, OpenAI says that it significantly improved the sycophancy of its AI chatbots with GPT-5, compared to GPT-4o, claiming the model is better at responding to mental health emergencies.
Moving forward, Zaremba and Carlini say they would like Anthropic and OpenAI to collaborate more on safety testing, looking into more subjects and testing future models, and they hope other AI labs will follow their collaborative approach.
Update 2:00pm PT: This article was updated to include additional research from Anthropic that was not initially made available to TechCrunch ahead of publication.
Got a sensitive tip or confidential documents? We’re reporting on the inner workings of the AI industry — from the companies shaping its future to the people impacted by their decisions. Reach out to Rebecca Bellan atrebecca.bellan@techcrunch.comand Maxwell Zeff atmaxwell.zeff@techcrunch.com. For secure communication, you can contact us via Signal at @rebeccabellan.491 and @mzeff.88.",**Título: Colaboración inusual entre OpenAI y Anthropic para pruebas de seguridad en modelos de IA**,"**Título: Colaboración inusual entre OpenAI y Anthropic para pruebas de seguridad en modelos de IA**

OpenAI y Anthropic, dos de los laboratorios de inteligencia artificial más prominentes del mundo, han iniciado una colaboración temporal para realizar pruebas de seguridad en sus modelos de IA, un hecho poco común en un entorno de competencia feroz. Este esfuerzo busca identificar brechas en las evaluaciones internas de cada compañía y resaltar cómo los líderes del sector pueden unirse en cuestiones de seguridad y alineación en el futuro. Según Wojciech Zaremba, cofundador de OpenAI, esta colaboración se vuelve crucial en un momento en que los modelos de IA están alcanzando una etapa ""consecuente"" de desarrollo, impactando la vida de millones de usuarios a diario.

El estudio conjunto fue publicado por ambos laboratorios y se produce en un contexto de intensa competencia entre ellos y otros actores clave, donde las apuestas multimillonarias en centros de datos y los paquetes de compensación de hasta $100 millones para investigadores se han vuelto comunes. Algunos expertos advierten que esta presión por innovar podría llevar a las empresas a descuidar la seguridad en su afán por desarrollar sistemas más potentes.

Para llevar a cabo esta investigación, OpenAI y Anthropic se otorgaron acceso especial a versiones de sus modelos de IA con menos salvaguardias; sin embargo, tras realizar las pruebas, Anthropic revocó el acceso a otro equipo de OpenAI, alegando una violación de sus términos de servicio. A pesar de este incidente, Zaremba asegura que el contexto competitivo se mantendrá, aunque los equipos de seguridad de IA intenten colaborar en el futuro. 

Seguí leyendo en este enlace: https://techcrunch.com/2025/08/27/openai-co-founder-calls-for-ai-labs-to-safety-test-rival-models/",https://techcrunch.com/wp-content/uploads/2025/01/GettyImages-2170386424.jpg?w=1024
