fuente,titulo,url,contenido,titulo_sugerido,resumen,imagenWired,What AI Models for War Actually Look Like,https://www.wired.com/story/ai-model-military-use-smack-technologies/,"Anthropic might have misgivings about giving the US military unfettered access to its AI models, but some startups are building advanced AI specifically for military applications.

Smack Technologies, which announced a $32 million funding round this week, is developing models that it says will soon surpass Claude’s capabilities when it comes to planning and executing military operations. And, unlike Anthropic, the startup appears less concerned with banning specific types of military use.

“When you serve in the military, you take an oath you're going to serve honorably, lawfully, in accordance with the rules of war,” says CEO Andy Markoff. “To me, the people who deploy the technology and make sure it is used ethically need to be in a uniform.”

Markoff is hardly a regular AI executive. A former commander in the US Marine Forces Special Operations Command, he helped execute high-stakes special forces operations in Iraq and Afghanistan. He cofounded Smack with Clint Alanis, another ex-Marine, and Dan Gould, a computer scientist who previously worked as the VP of technology at Tinder.

Smack’s models learn to identify optimal mission plans through a process of trial and error, similar to how Google trained its 2017 program AlphaGo. In Smack’s case, the strategy involves running the model through various war game scenarios and having expert analysts provide a signal that tells the model if its chosen strategy will pay off. The startup may not have the budget of a conventional frontier AI lab, but it’s spending millions to train its first AI models, Markoff says.

Battle Lines

Military use of AI has become a hot topic in Silicon Valley after officials at the Department of Defense went head-to-head with Anthropic executives over the terms of a roughly $200 million contract.

One of the issues that led to the breakdown, which resulted in defense secretary Pete Hegseth declaring Anthropic a supply chain risk, was Anthropic’s desire to limit the use of its models in autonomous weapons.

Markoff says the furor obscures the fact that today’s large language models are not optimized for military use. General-purpose models like Claude are good at summarizing reports, he says. But they’re not trained on military data and lack a human-level understanding of the physical world, making them ill suited to controlling physical hardware. “I can tell you they are absolutely not capable of target identification,” Markoff claims.

“No one that I'm aware of in the Department of War is talking about fully automating the kill chain,” he claims, referring to the steps involved in making decisions on the use of deadly force.

Mission Scope

The US and other militaries already use autonomous weapons in certain situations, including in missile defense systems that need to react at superhuman speeds.

“The US and over 30 other states are already deploying weapon systems with varying degrees of autonomy, including some I would define as fully autonomous,” claims Rebecca Crootof, an authority on the legal issues surrounding autonomous weapons at the University of Richmond School of Law.

In the future, specialized models like the one Smack is working on could be used for mission planning purposes, too, according to Markoff. The company’s models are meant to help commanders automate much of the drudgery involved in sketching out mission plans. Planning military missions is still typically done manually with whiteboards and notepads, Markoff says.

If the US went to war with a “near peer” such as Russia or China, Markoff says, automated decisionmaking could offer the US a much needed “decision dominance.”

But it’s still an open question whether AI could be used reliably in such circumstances. One recent experiment, run by a researcher at King’s College London, alarmingly showed that LLMs tended to escalate nuclear conflicts in war games.",**Título: Smack Technologies impulsa la IA militar con enfoque operativo y sin restricciones éticas**,"**Título: Smack Technologies impulsa la IA militar con enfoque operativo y sin restricciones éticas**

En medio de un creciente debate en Silicon Valley sobre el uso de inteligencia artificial en defensa, mientras empresas como Anthropic negociaban restricciones éticas en contratos multimillonarios con el Pentágono, surgió una startup con una filosofía radicalmente distinta. Smack Technologies, que acaba de securing una ronda de financiación de 32 millones de dólares, se posiciona como un actor dedicado exclusivamente a desarrollar modelos de IA avanzados para aplicaciones militares, con el objetivo declarado de superar las capacidades de sistemas como Claude en planificación y ejecución de operaciones.

La compañía, cofundada por el excomandante de Fuerzas Especiales de Marines Andy Markoff y otros veteranos militares, adopta un enfoque que prioriza la confianza en las instituciones castrenses sobre las restricciones técnicas impuestas por los desarrolladores. Markoff argumenta que la responsabilidad ética recae en el personal uniformado que despliega la tecnología, no en los límites programados en el código. Sus modelos se entrenan mediante un proceso de prueba y error en simulations de guerra, donde analistas expertos califican la viabilidad de las estrategias generadas por la IA, una metodología que recuerda al aprendizaje used en AlphaGo de DeepMind.

Este desarrollo ocurre en un contexto de tensiones entre el Departamento de Defensa y actores de la IA convencional, tras la ruptura de negociaciones con Anthropic por around de 200 millones de dólares, donde las limitaciones a usos autónomos fueron un punto de fricción clave. Smack representa la otra cara de la moneda: una empresa que no solo acepta, sino que abraza, el desarrollo de capacidades ofensivas sin las ""guardianes"" éticos que otras firmas imponen. Su relevancia radica en cómo podría redefinir la aceleración de la integración de IA en el campo de batalla, planteando preguntas urgentes sobre la rendición de cuentas, la proliferación y los marcos legales internacionales en conflictos futuros. La apuesta de Smack sugiere que la próxima frontera en IA de defensa podría ser dictada por actores con mentalidad operativa y sin los reparos morales que hoy dividen a la industria tecnológica.

Seguí leyendo en este enlace: https://www.wired.com/story/ai-model-military-use-smack-technologies/","https://media.wired.com/photos/69c1d8642542d076d32a59b2/191:100/w_1280,c_limit/ai_lab_autonomous_weapons.jpg"
The Verge,Bespoke AI models are the next big thing in filmmaking,https://www.theverge.com/streaming/893538/ai-model-netflix-interpositive-ben-affleck,"is a reporter focusing on film, TV, and pop culture. Before The Verge, he wrote about comic books, labor, race, and more at io9 and Gizmodo for almost five years.

But we’re starting to see more AI firms building a new breed of generative model — ones that are designed to address creatives’ needs throughout the development process while also avoiding issues like potential copyright infringement. What really sets these models apart from their peers, though, is the way they can purportedly be customized through training that turns them into bespoke tools that are tailor-made for every project.

Customizability was one of the major points that Netflix emphasized last week when the company announced that it is absorbing InterPositive, an AI startup founded by Ben Affleck in 2022. Though Netflix has not disclosed how much it paid for InterPositive, Bloomberg reports that the figure could be as much as $600 million. While Netflix productions have used gen AI before, the acquisition was notable because the streamer publicly highlighted its plans to make the technology a foundational part of its business. Netflix — which declined to speak with The Verge for this piece — didn’t share much about when and how it will internally deploy InterPositive’s models. But the company is presenting InterPositive’s AI as a tool that’s designed to “empower” filmmakers rather than eliminate them from the equation.

In a statement about the acquisition, Affleck explained how InterPositive’s team filmed “a proprietary dataset on a controlled soundstage with all the familiarities of a full production” that serves as the basis for the company’s core model.

“I wanted to build a workflow that captures what happens on a set, with vocabulary that matched the language cinematographers and directors already spoke and included the kind of consistency and controls they would expect,” Affleck said. “The results of this foundational work were deliberately smaller datasets and models focused on filmmaking techniques — rather than performances — creating tools that artists can use, control, and benefit from.”

In a workflow built around this tech, Netflix can create unique versions of InterPositive’s model by training it on dailies from in-progress shoots. Filmmakers can then use those project-specific models to generate and manipulate different kinds of visual elements later on in the postproduction process. Netflix says that these models can help directors tinker with a specific scene’s lighting, edit out unwanted details like prop rigging, or replace backgrounds entirely. And because the models are trained on raw footage from the movies or series they’re being used for, their outputs can (purportedly) match a filmmaker’s creative vision with ease.

This all sounds impressive on paper, but it presumes that InterPositive’s core models were trained on enough production scenarios to be able to generate outputs that align with whatever kinds of scenes filmmakers think of. Part of what makes this tricky is that there are no set standards for things like Good Lighting™ that can be unilaterally applied to every single kind of movie or series that Netflix might release. This might be why InterPositive’s models need to be trained on dailies before they can churn out anything that might be useful during postproduction. But it’s easy to see why a pitch like this would appeal to a studio looking to put out more projects while keeping costs down.

Affleck’s description of InterPositive sounds a lot like the basic idea behind Asteria, Bryn Mooser’s AI-forward studio that is currently producing Natasha Lyonne’s upcoming feature about a virtual reality game. Like InterPositive, Asteria’s flagship product is a proprietary gen AI model that can be customized by being trained on datasets consisting of a client’s original art. Asteria also just announced that it is releasing Continuum Suite, an AI-powered operating system that analyzes scripts to generate a complex database containing information about characters, scenes, storyboards, schedules, and budgets.

Asteria’s big selling point is that its vanilla AI model is “ethical” because its core dataset is composed of material that the company has licensed. But whereas InterPositive’s models seem more focused on tweaking details, Asteria’s have been used to generate things like complete characters and background objects that share an aesthetic derived from the model’s dataset.

This makes Asteria’s tech ideal for filmmakers who want to flesh out their projects with things that all look like they were designed by the same artistic team. In theory, it also helps studios prevent their partners from deploying gen AI in ways that could lead to lawsuits over whether someone has stolen IP. Asteria and InterPositive both see their products as tools that can help speed production timelines up without spending more money, and that framing seems to be the main thing that’s driving more traditional studios to hop on the AI bandwagon.

Compared to Netflix, most other production houses haven’t been quite as open about their interest in and experimentation with AI. But you can see the industry shifting in a pro-AI direction in things like Adobe’s recently announced partnership with multiple studios to develop “IP-safe” models that can be used across the company’s larger suite of production tools. What’s harder to pinpoint here is how, if at all, human artists will benefit from this shift.

Creating more things faster and more cheaply can help studios (and their executive leadership) boost profits. But those things don’t inherently lead to creative workers keeping their jobs, receiving bigger paychecks, or having more time outside of the office. As much as these newer AI companies talk about “empowering” creatives, they seldom go into detail about what that empowerment actually looks like. And until they do (or can), we should all keep looking at their products with some skepticism.",**Los modelos de IA a medida marcan un nuevo rumbo en la industria cinematográfica**,"**Los modelos de IA a medida marcan un nuevo rumbo en la industria cinematográfica**

La industria del entretenimiento está experimentando una transformación impulsada por una nueva generación de inteligencia artificial. A diferencia de los modelos generativos de propósito general, las empresas emergentes están desarrollando sistemas especializados, o ""a medida"", diseñados para integrarse en flujos de trabajo creativos específicos y mitigar riesgos como las infracciones de derechos de autor. La capacidad de personalización mediante entrenamiento dedicado se presenta como su característica definitoria, permitiendo herramientas adaptadas a las necesidades únicas de cada proyecto.

Este enfoque ha alcanzado un punto culminante con la reciente adquisición de InterPositive por parte de Netflix. La startup, fundada en 2022 por el actor y cineasta Ben Affleck, fue absorbida por el gigante del streaming en una operación que, según reportes de Bloomberg, podría ascender a 600 millones de dólares. Aunque Netflix no ha detallado los planes de implementación interna, la compañía enmarcó la compra como un compromiso estratégico para hacer de la IA un ""pilar fundamental"" de su negocio, promoviendo la narrativa de que la tecnología está diseñada para ""empoderar"" a los cineastas, no para reemplazarlos.

La propuesta técnica de InterPositive se centra en un modelo base entrenado con un ""conjunto de datos propios"" capturado en un set de filmación controlado. Según explicó Affleck, el desarrollo buscó replicar el flujo de trabajo real de una producción, utilizando la vocación y los controles familiares para directores de fotografía y directores, priorizando la coherencia sobre la escala de los datos. Este enfoque de ""cuadro de mando"" (interpositive, en terminología cinematográfica) sugiere un puente entre la tecnología generativa y los procesos artesanales tradicionales.

La relevancia de este movimiento trasciende la adquisición en sí. Netflix, uno de los mayores productores y distribuidores mundiales, está enviando una señal clara sobre la dirección de la innovación en Hollywood: hacia herramientas de IA especializadas, de propiedad interna y alineadas con la creatividad humana. Este modelo podría redefinir las asociaciones entre estudios tecnológicos y creadores, estableciendo un precedente para cómo la IA puede integrarse respetando —y potencialmente mejorando— las jerarquías y lenguajes creativos existentes, en lugar de imponer soluciones ajenas. El éxito o fracaso de esta integración será observado de cerca por toda la cadena de valor audiovisual.

Conocé más en este enlace: https://www.theverge.com/streaming/893538/ai-model-netflix-interpositive-ben-affleck",
