fuente,titulo,url,contenido,titulo_sugerido,resumen,imagenThe Verge,DLSS 5: Has Nvidia’s AI graphics technology gone too far?,https://www.theverge.com/games/896518/nvidia-dlss-5-ai-3d-rendering,"Nvidia has revealed a new “3D guided neural rendering model” called DLSS 5 that can change a game’s lighting and materials in real-time, and… many gamers aren’t happy. From DLSS 5 memes to complaints about how it’s “yassified” Resident Evil Requiem characters in demos, the first impression has not been a good one, no matter how much Nvidia insists that this pursuit of photorealism is still honoring the original artists’ intent.","**DLSS 5: La IA de Nvidia redibuja el renderizado 3D en tiempo real, pero divide a la comunidad**","**DLSS 5: La IA de Nvidia redibuja el renderizado 3D en tiempo real, pero divide a la comunidad**

Nvidia ha presentado DLSS 5, la próxima evolución de su tecnología de superresolución impulsada por inteligencia artificial, alejándose significativamente de su función original de upscaling. Este nuevo sistema, denominado ""modelo de renderizado neuronal guiado en 3D"", no se limita a aumentar la resolución de una imagen, sino que modifica proactivamente elementos fundamentales de la escena en tiempo real, como la iluminación, los materiales y las sombras, durante el proceso de renderizado del juego. Este avance, que promete un salto cualitativo en la fidelidad fotográfica, ha generado una reacción inmediata y polarizada dentro de la comunidad de jugadores y desarrolladores.

La demostración técnica, mostrada en títulos como *Resident Evil Requiem*, ha sido el foco de las críticas. Varios usuarios han señalado que los personajes y entornos pierden la estética y el estilo artístico original, adoptando un aspecto excesivamente realista o ""yassificado"" que, para muchos, distorsiona la visión creativa de los artistas. Este fenómeno ha dado lugar a una avalancha de memes y quejas en redes sociales, cuestionando si la tecnología ha cruzado un límite al imponer su propia interpretación estética sobre el trabajo de diseño. Frente a esto, Nvidia defiende que el sistema está diseñado para ""honrar la intención original de los artistas"", argumentando que su modelo de IA ha sido entrenado para comprender y complementar, no reemplazar, las decisiones de iluminación y materiales establecidas en el desarrollo.

El impacto potencial de DLSS 5 es profundo. Técnicamente, representa un cambio de paradigma al integrar la reconstrucción de imagen con la generación de componentes de la escena, lo que podría permitir a los desarrolladores alcanzar niveles de realismo antes impensables sin un coste de rendimiento prohibitivo. Sin embargo, su recepción subraya una tensión creciente en la industria: el equilibrio entre la innovación tecnológica y la preservación de la identidad artística. La aceptación de esta herramienta dependerá en gran medida de cómo los estudios de desarrollo decidan implementarla y ajustar sus parámetros, y de si los jugadores priorizan la fidelidad visual pura sobre el estilo autoral. La controversia inicial sugiere que el debate sobre el rol de la IA en la creación artística digital acaba de intensificarse. Conocé más en este enlace: https://www.theverge.com/games/896518/nvidia-dlss-5-ai-3d-rendering.",
TechCrunch,Spotify tests new tool to stop AI slop from being attributed to real artists,https://techcrunch.com/2026/03/24/spotify-tests-new-tool-to-stop-ai-slop-from-being-attributed-to-real-artists/,"At a time whenAI slopisflooding music streamingplatforms, Spotify is beta testing a new “Artist Profile Protection” feature that allows artists to review releases before they go live on their profiles. The idea behind the new tool is to give artists more control over which tracks are associated with their name on the streaming service.
“Music has been landing on the wrong artist pages across streaming services, and the rise of easy-to-produce AI tracks has made the problem worse,” Spotify wrote in ablog post. “That’s not the experience we want artists to have on Spotify, and that’s why we’ve made protecting artist identity a top priority for 2026. Today, we’re announcing a first-of-its-kind solution to a problem that’s affected streaming for years.”
Artists in the beta have the ability to review and approve or decline releases delivered to Spotify. Only the releases that they approve will appear on their artist profile, contribute to their stats, and show up in users’ recommendations.
Spotify’s announcement comes a week after Sony Music said that it hasrequested the removalof more than 135,000 AI-generated songs impersonating its artists on streaming services.
Spotify says that while open distribution has made it easier for independent artists to release music, it also creates opportunities for mistakes and bad actors. Tracks can end up on the wrong artist’s profile due to metadata errors, confusion between artists with the same name, or malicious attempts to attach music to an artist’s profile.
“When that happens, it can impact your catalog, your stats, your Release Radar, and how fans discover your music,” Spotify explains. “We know how frustrating this can be for both artists and fans alike and one of the top requests we’ve heard from artists over the past year is that you want more visibility before music appears under your name.”
Spotify notes that while the new feature isn’t necessary for every artist, it’s designed for artists who have experienced repeated incorrect releases, have a common artist name, or want more control over what appears on their profile.
Artists who are included in the beta will see the feature in their “Spotify for Artists” settings on desktop and mobile web. If they turn “Artist Profile Protection” on, they’ll receive an email notification when music is delivered to Spotify with their name attached to it. From there, they can approve or decline the request.",**Spotify lanza herramienta para proteger perfiles de artistas de contenido generado por IA**,"**Spotify lanza herramienta para proteger perfiles de artistas de contenido generado por IA**

En un contexto de proliferación de música creada mediante inteligencia artificial que inunda las plataformas de streaming, Spotify ha iniciado una prueba beta de una nueva función llamada ""Protección de Perfil del Artista"". Esta herramienta responde directamente a un problema crónico: la atribución errónea de pistas, agravada por la facilidad para generar contenido de IA. La funcionalidad otorga a los artistas la capacidad de revisar y aprobar o rechazar los lanzamientos destinados a su perfil antes de que se publiquen. Solo las pistas aprobadas aparecerán en su perfil oficial, influirán en sus estadísticas y serán incluidas en las recomendaciones para los usuarios.

El anuncio se produce tras la revelación de Sony Music de que solicitó la eliminación de más de 135.000 canciones generadas por IA que suplantaban a sus artistas en servicios de streaming. Spotify señala que, si bien la distribución abierta facilita el acceso a creadores independientes, también incrementa los riesgos de errores en metadatos, confusiones entre artistas homónimos o actos maliciosos. Estas situaciones afectan el catálogo, las métricas de reproducción, la visibilidad en herramientas como Release Radar y, en definitiva, el descubrimiento de la música por parte del público.

La compañía califica la protección de la identidad del artista como una ""prioridad máxima para 2026"". La función, aunque no es obligatoria para todos, está diseñada específicamente para artistas que han sufrido repetidas incorrecciones en su perfil. Este movimiento representa un cambio significativo en el equilibrio de poder dentro de las plataformas, trasladando un mayor control de la integridad del contenido al propio creador. La medida busca mitigar el llamado ""AI slop"" y preservar la confianza en la atribución, un pilar fundamental para la economía del streaming y la relación con los fans.

Seguí leyendo en este enlace: https://techcrunch.com/2026/03/24/spotify-tests-new-tool-to-stop-ai-slop-from-being-attributed-to-real-artists/",https://techcrunch.com/wp-content/uploads/2026/02/spotify-logo-phone-GettyImages-2236404299.jpg?w=1024
TechCrunch,Google launches Lyria 3 Pro music generation model,https://techcrunch.com/2026/03/25/google-launches-lyria-3-pro-music-generation-model/,"Googleannouncedon Wednesday that it’s releasing Lyria 3 Pro, a music generation model, a month afterLyria 3’srelease. The new model will let users create tracks up to three minutes long, as compared to the 30-second-long tracks offered with the Lyria 3 model.
The company said that, apart from allowing users to create longer tracks, the Lyria 3 Pro model will offer better creative control and customization. In the prompt, users can also specify different elements of a musical piece, such as intros, verses, choruses, and bridges, as the model understands track structure better than its predecessor.
Google previously brought music generation capability tothe Gemini app with the Lyria 3 release. The Pro model is also rolling out in the Gemini app, but only paid subscribers will gain access to it. The company is also rolling out Lyria 3 Pro to itsGoogle Vids video editing appand ProducerAI, aGenAI-powered music production tool, which Google acquired last month.
In addition, Google is adding music generation capability to its enterprise tools with Vertex AI (in public preview), the Gemini API, and AI Studio through the Lyria 3 Pro model.
Google emphasized that it used data from its partners and permissible data from YouTube and Google to train this model. It also said that the model doesn’t mimic an artist. However, it said that if users specify an artist in prompts, it takes “broad inspiration” from that artist to generate a track.
All tracks that are created using Lyria 3 and Lyria 3 Pro are marked with SynthID to denote that AI was used to make this track.
Earlier this week, Spotify released new tools to let artistsreview songs released under their nameso that AI slop creators don’t misattribute music. Meanwhile, Deezer has launchedtools to let any streaming service identify AI-generated music.
",**Google presenta Lyria 3 Pro: generación musical extendida y con mayor control creativo**,"**Google presenta Lyria 3 Pro: generación musical extendida y con mayor control creativo**

Google anunció el lanzamiento de Lyria 3 Pro, un modelo avanzado de generación de música, exactamente un mes después de la debut de Lyria 3. Esta evolución aborda una limitación clave de su predecesor, ampliando significativamente la duración de las pistas generadas de 30 segundos a un máximo de tres minutos, un salto sustancial para aplicaciones prácticas. Más allá de la extensión temporal, Lyria 3 Pro introduce un control creativo refinado, permitiendo a los usuarios especificar en sus prompts elementos estructurales como intros, versos, estribillos y puentes, lo que refleja una comprensión mejorada de la arquitectura de una canción por parte del modelo.

El acceso a Lyria 3 Pro se integra en el ecosistema de Google, pero con un enfoque inicial en suscriptores de pago de la aplicación Gemini, donde la capacidad de generación musical se introdujo con Lyria 3. También se está implementando en Google Vids (para edición de video) y en ProducerAI, una herramienta de producción musical con IA que Google adquirió recientemente. Un aspecto estratégico es su disponibilidad para entornos empresariales a través de Vertex AI (en vista previa pública), la API de Gemini y AI Studio, ampliando su alcance a desarrolladores y organizaciones.

Google detalló que el entrenamiento de Lyria 3 Pro utilizó datos de socios autorizados, así como material permisible de YouTube y Google. La compañía aclara que el modelo no busca imitar a artistas específicos, aunque si un usuario menciona uno en el prompt, el sistema puede tomar una ""inspiración general"" para guiar la generación. En línea con las prácticas de transparencia en IA generativa, todas las creaciones de Lyria 3 y Lyria 3 Pro portan la marca de agua digital SynthID, que identifica de forma inequívoca el contenido creado con inteligencia artificial.

Este lanzamiento se produce en un contexto de creciente actividad en el sector para gestionar el contenido musical generado por IA. Recientemente, Spotify presentó herramientas para que los artistas revisen canciones publicadas bajo su nombre, mientras que Deezer lanzó sistemas para que cualquier servicio de streaming detecte música de IA. La apuesta de Google por un modelo más capaz y su integración en productos masivos y empresariales subraya la aceleración en la democratización de la creación musical asistida por IA y los esfuerzos paralelos por establecer estándares de atribución y protección de derechos.

Conocé más en este enlace: https://techcrunch.com/2026/03/25/google-launches-lyria-3-pro-music-generation-model/","https://techcrunch.com/wp-content/uploads/2026/03/Lyria-3-Pro_thumbnail.jpeg?resize=1200,675"
TechCrunch,Mistral releases a new open source model for speech generation,https://techcrunch.com/2026/03/26/mistral-releases-a-new-open-source-model-for-speech-generation/,"French AI company Mistral released a new open source text-to-speech model on Thursday that can be used by voice AI assistants or in enterprise use cases like customer support. The model, which lets enterprises build voice agents for sales and customer engagement, puts Mistral in direct competition with the likes of ElevenLabs, Deepgram, and OpenAI.
The new model, called Voxtral TTS, supports nine languages, including English, French, German, Spanish, Dutch, Portuguese, Italian, Hindi, and Arabic.
“Our customers have been asking for a speech model. So we built a small-sized speech model that can fit on a smartwatch, a smartphone, a laptop, or other edge devices. The cost of it is a fraction of anything else on the market, but it offers state-of-the-art performance,” Pierre Stock, VP of science operations at Mistral AI, told TechCrunch during a phone interview.
Mistral said the new model can adapt a custom voice with a sample of less than five seconds and can capture characteristics like subtle accents, inflections, intonations, and irregularities in the flow of speech. The model, based onMinistral3B, can switch between languages easily without losing the characteristics of the voice, which is useful for use cases like dubbing or real-time translation. Stock said the company wanted the model to sound human and not robotic.
The model has been built for real-time performance, according to the company. It has a time-to-first-audio (TTFA) — a measure of when the model starts “speaking” after receiving input — of 90 ms for a 10-second sample of 500 characters. The model also has a real-time factor (RTF) of 6x, which means it can render a 10-second clip in roughly 1.6 seconds.
Earlier this year, Mistral launcheda pair of transcription models, one for large batch processing and the other for real-time use cases with low latency. With the new speech model, the company is likely aiming to provide a full suite of voice products to enterprises.
“We plan to have an end-to-end platform that can handle multimodal streams of input, including audio, text, and image and output as well. The main benefit of that is you get way more information with an end-to-end agentic system that supports audio as an input or output,” Stock said.
Mistral’s positioning is that its open source and customization bit will help enterprises adopt its voice models over competitors, as they can tune it the way they want.","**Mistral impulsa la competencia en síntesis de voz con Voxtral TTS, su modelo de código abierto**","**Mistral impulsa la competencia en síntesis de voz con Voxtral TTS, su modelo de código abierto**

En un mercado de síntesis de voz cada vez más concurrido, donde gigantes como ElevenLabs, Deepgram y OpenAI establecen el estándar, la startup francesa Mistral AI ha dado un paso estratégico con el lanzamiento de Voxtral TTS, un modelo de texto a voz de código abierto. Este movimiento no solo amplía su cartera de productos, sino que posiciona a la compañía como un proveedor integral de soluciones de voz para empresas, compitiendo directamente en un segmento de alta demanda para asistentes de IA y casos de uso corporativos como el soporte al cliente.

El modelo, presentado oficialmente, destaca por su eficiencia y versatilidad. Basado en la arquitectura Ministral 3B, Voxtral TTS está diseñado para ser ligero, con un tamaño que permite su despliegue en dispositivos de borde como *smartwatches*, teléfonos inteligentes y portátiles. Según Pierre Stock, vicepresidente de operaciones científicas de Mistral, su costo es ""una fracción de cualquier otro en el mercado"", sin sacrificar un rendimiento de vanguardia. Soporta nueve idiomas (inglés, francés, alemán, español, holandés, portugués, italiano, hindi y árabe) y puede clonar una voz personalizada con una muestra de audio de menos de cinco segundos, capturando matices como acentos, inflexiones y patrones de habla irregulares. Una característica clave es su capacidad para cambiar entre idiomas sin perder la identidad vocal, una ventaja significativa para doblaje o traducción en tiempo real.

En términos de rendimiento, Voxtral TTS está optimizado para aplicaciones en tiempo real. Su tiempo hasta el primer audio (TTFA) es de 90 milisegundos para una muestra de 500 caracteres, y su factor de tiempo real (RTF) es de 6x, lo que significa que puede generar un clip de 10 segundos en aproximadamente 1.6 segundos. Este lanzamiento se produce después de que Mistral introdujera a principios de año modelos de transcripción por lotes y en tiempo real, completando así una suite de productos de voz que busca ofrecer un flujo de trabajo completo, desde la transcripción hasta la síntesis, para el entorno empresarial. Con Voxtral TTS, Mistral no solo introduce un competidor técnicamente sólido y accesible, sino que refuerza su apuesta por la democratización de herramientas de IA avanzadas a través del código abierto.

Conocé más en este enlace: https://techcrunch.com/2026/03/26/mistral-releases-a-new-open-source-model-for-speech-generation/","https://techcrunch.com/wp-content/uploads/2026/03/GettyImages-2264771189.jpg?resize=1200,800"
TechCrunch,Startup Gimlet Labs is solving the AI inference bottleneck in a surprisingly elegant way,https://techcrunch.com/2026/03/23/startup-gimlet-labs-is-solving-the-ai-inference-bottleneck-in-a-surprisingly-elegant-way/,"Stanford adjunct professor and successfully exited founder Zain Asgar just raised an $80 million Series A for a startup that solve the AI inference bottleneck problem in an astute way. The round was led by Menlo Ventures.
The company,Gimlet Labs, has created what it claims is the first and only “multi-silicon inference cloud” which is software that allows an AI workload to be simultaneously run across diverse types of hardware. It can split an AI app’s work across both traditional CPUs and AI-tuned GPUs, as well as high-memory systems.
“We basically run across whatever different hardware that’s available,” Asgar told TechCrunch.
A single agent may chain together multiple steps, and each “requires different hardware: Inference is compute-bound; decode is memory-bound; and tool calls are network-bound,” writes lead investor, Menlo’s Tim Tully, in a blog post about the funding.
No chip yet does it all, but as new hardware gets rolled out, and aging GPUs get redeployed, “the multi-silicon fleet is ready — it’s just missing the software layer to make it work.” That’s what Tully believes Gimlet Labs offers.
If the current deploy-more-compute trend continues,McKinsey estimatesdata center spending will tally nearly $7 trillion by 2030. Asgar says that apps are only using the existing hardware already deployed “somewhere between 15 to 30 percent” of the time.
“Another way to think about this: you’re wasting hundreds of billions of dollars because you’re just leaving idle resources,” he said. “Our goal was basically to try to figure out how you can get AI workloads to be 10x more efficient than ever, today.”
So he and his cofounders, Michelle Nguyen, Omid Azizi, and Natalie Serrino, set about building orchestration software that slices up agentic workloads so that they can be simultaneous spread across all kinds of hardware.
Gimlet Labs claims it reliably speeds AI inference up by 3x to 10x for the same cost and power. Gimlet says it can even slice the underlying model so that it runs across different architectures, using the best chip for each portion of the model.
The company has already partnered with chip makers NVIDIA, AMD, Intel, ARM, Cerebras and d-Matrix.
Gimlet’s product, delivered either as software or through an API to its own Gimlet Cloud, isn’t for the rank-and-file AI app developer. It’s for the largest AI model labs and data centers.
The company publicly launchedin Octoberwith, it said, eight-figure revenues out of the gate (so at least $10 million). Asgar said that his customer base has more than doubled in the last four months and now includes a major model maker and an extremely large cloud computing company, although he declined to name them.
The cofounders had previously worked together at Pixie, a startup that created an open source observability tool for Kubernetes. Pixie wasacquiredby New Relic in 2020, just two months after it launched with a $9 million Series A led by Benchmark. (Pixie’s tech is now part of the open source org that oversees Kubernetes.)
After Asgar randomly ran into Tully about a year ago and also received angel investments from Stanford professors, VCs started calling. After launch, a term sheet landed on Asgar’s desk. When VCs heard Asgar was looking at offers, “we got a pretty big swarm of funding,” and the round was quickly oversubscribed, he said.
With the previous seed, the startup has now raised a total of $92 million, including from a slew of angels like Sequoia’s Bill Coughran, Stanford Professor Nick McKeown, former CEO of VMware Raghu Raghuram and Intel CEO Lip-Bu Tan. The company currently employs 30 people.
Other investors include Factory, who led the seed, Eclipse Ventures, Prosperity7 and Triatomic.",**Título:** Gimlet Labs resuelve el cuello de botella de inferencia en IA con una nube multi-silicio que optimiza el hardware existente,"**Título:** Gimlet Labs resuelve el cuello de botella de inferencia en IA con una nube multi-silicio que optimiza el hardware existente

El vertiginoso avance de los modelos de inteligencia artificial ha generado una paradoja crítica: a pesar de la proliferación de hardware especializado, desde GPUs de alto rendimiento hasta sistemas de alta memoria, la infraestructura subyacente opera de manera fragmentada e ineficiente. Esta desconexión entre el software de IA y el hardware diversificado ha llevado a un grave desperdicio de recursos, donde las cargas de trabajo de inferencia —la fase de ejecución de modelos entrenados— solo aprovechan entre un 15% y un 30% de la capacidad instalada, según estimaciones de la industria. Ante este escenario, la startup Gimlet Labs, fundada por el profesor adjunto de Stanford y emprendedor en serie Zain Asgar, ha desarrollado una solución que promete redefinir la eficiencia operativa en centros de datos.

La compañía acaba de cerrar una ronda de financiación Serie A de 80 millones de dólares, liderada por Menlo Ventures, para escalar su plataforma. Su innovación central es un software de orquestación que crea lo que describe como la primera ""nube multi-silicio"" del sector. Esta capa de software permite que una única aplicación de IA, especialmente los agentes autónomos o *agentic workflows*, descomponga y distribuya sus tareas de forma simultánea entre diferentes tipos de hardware —CPUs tradicionales, GPUs optimizadas para IA y sistemas de memoria alta— según las necesidades específicas de cada paso. Como explica Asgar, mientras una fase de inferencia es intensiva en cómputo, la decodificación puede ser limitada por memoria y las llamadas a herramientas externas dependen de la red. Gimlet Labs asigna dinámicamente cada subproceso al recurso más adecuado disponible.

La relevancia de este enfoque es monumental. Si la tendencia actual de simplemente añadir más cómputo continúa, McKinsey proyecta que el gasto global en centros de datos rozará los 7 billones de dólares para 2030. Gimlet Labs afirma que su tecnología puede multiplicar por tres y hasta por diez la velocidad de inferencia de las aplicaciones de IA sin aumentar el costo ni el consumo energético, utilizando el mismo parque hardware heterogéneo que ya poseen las empresas. El inversor principal, Tim Tully de Menlo Ventures, señala que el ecosistema de hardware diverso ya existe, pero carecía de la capa de software unificadora que ahora ofrece Gimlet. Esta solución no solo promete aliviar el cuello de botella de inferencia, sino también maximizar el retorno de las masivas inversiones en infraestructura de IA, ofreciendo una vía pragmática y escalable hacia la eficiencia. **Seguí leyendo en este enlace: https://techcrunch.com/2026/03/23/startup-gimlet-labs-is-solving-the-ai-inference-bottleneck-in-a-surprisingly-elegant-way/**.","https://techcrunch.com/wp-content/uploads/2026/03/Gimlet_Labs_CEO_Zain_Asgar2.jpg?resize=1200,747"
