fuente,titulo,url,contenido,titulo_sugerido,resumen,imagen
TechCrunch,Mantis Biotech is making ‘digital twins’ of humans to help solve medicine’s data availability problem,https://techcrunch.com/2026/03/30/mantis-biotech-is-making-digital-twins-of-humans-to-help-solve-medicines-data-availability-problem/,"Large language models trained on vast datasets could speed genomics research, streamline clinical documentation, improve real-time diagnostics, support clinical decision-making, accelerate drug discovery, and even generate synthetic data to advance experiments.
But their promise to transform biomedical research often runs into a bottleneck: beyond the structured data healthcare relies on, these models struggle in edge cases like rare diseases and unusual conditions, where reliable, representative data is scarce.
New York-basedMantis Biotechclaims it’s developing the solution to fill this data availability gap. The company’s platform integrates disparate sources of data to make synthetic datasets that can be used to build so-called “digital twins” of the human body: physics-based, predictive models of anatomy, physiology, and behavior.
The company is pitching these digital twins for use in data aggregation and analysis. These digital twins could be used for studying and testing new medical procedures, training surgical robots, and simulating and predicting medical issues or even patterns of behavior. For example, a sports team could predict the likelihood of a specific NFL player developing an Achilles heel injury based on their recent performance, training load, diet, and how long they’ve been active, Mantis’ founder and CEO Georgia Witchel explained to TechCrunch in a recent interview.
To build these twins, Mantis’ platform first takes data from a variety of sources such as textbooks, motion capture cameras, biometric sensors, training logs and medical imaging. Then, it uses an LLM-based system to route, validate, and synthesize the various data streams, and runs all that information through a physics engine to create high-fidelity renders of that dataset, which can then be used to train predictive models.
“We’re able to take all these disparate data sources and then turn them into predictive models for how people are going to perform. So anytime you want to predict how a human being is going to be performing, that is a really good use case for our technology,” Witchel said.
The physics engine layer is key here, Witchel told TechCrunch, because it helps the platform enhance the available information by grounding the generated synthetic data and realistically modeling the physics of anatomy.
“If I asked you to do hand-pose estimation for someone who is missing a finger, it would be really, really hard, because there are no publicly available datasets of labeled hand positions of someone who is missing a finger. We could generate that dataset really, really easily, because we just take our physics model and we say, remove finger X, regenerate model,” she said.
Since Mantis’ platform fills gaps in data sources, Witchel thinks there’s potential for it to be used widely across the biomedical industry, where information on procedures or patients can be difficult to access, is unstructured or siloed into various sources. She stressed edge cases or rare diseases, where data is hard to obtain since there are often ethical and regulatory constraints around including patients’ data in public datasets, or using it for training AI models.
“You know how when you see a three-year-old running around, and they have a Barbie, and they’re holding it by one leg and smashing it against a table? I want people to have that mindset with our digital twins,” she said. “I think that’s going to open up people to this idea that humans can be tested on when you’re using virtual humans. I feel currently, people operate with the exact opposite mindset, which totally makes sense, because people’s privacy should be respected. In fact, I don’t really think people’s data should be exploited at all, especially when you have these digital twins.”
For now, Mantis has seen success in professional sports, presumably because there is a need to model high-performing athletes. Witchel said one of the startup’s main clients is an NBA team.
“We create these digital representations of the athletes, where it basically shows here’s how this athlete has jumped, not just today, but for every single day in the past year, and here’s how their jumps are changing over time compared to the amount that they’re sleeping, or compared to how many times they lift their arms above their head,” she explained.
The startup recently raised $7.4 million in seed funding led by Decibel VC, with participation from Y Combinator, a few angel investors, and Liquid 2. The funding will be used for hiring, advertising, marketing and go-to-market functions.
The next step for Mantis, Witchel said, is to continue building out the tech, and eventually release the platform to the general public, targeting preventative healthcare. The company is also working to cater to pharmaceutical labs and researchers working on FDA trials, aiming to deliver insights into how patients are responding to treatments.",**Mantis Biotech desarrolla 'gemelos digitales' humanos para superar la escasez de datos biomédicos**,"**Mantis Biotech desarrolla 'gemelos digitales' humanos para superar la escasez de datos biomédicos**

El potencial de los grandes modelos de lenguaje (LLM) entrenados con vastos conjuntos de datos para revolucionar la investigación biomédica —desde la genómica y el descubrimiento de fármacos hasta el diagnóstico en tiempo real— choca con un cuello de botella fundamental: la escasez de datos fiables y representativos en casos límite, como enfermedades raras o condiciones atípicas. Esta brecha de disponibilidad de datos limita la capacidad de estos sistemas para generalizar y ofrecer predicciones robustas en escenarios clínicos complejos.

Frente a este desafío, la startup neoyorquina Mantis Biotech anuncia el desarrollo de una plataforma que crea ""gemelos digitales"" del cuerpo humano. Su solución integra fuentes de información dispares —desde imágenes médicas y sensores biométricos hasta registros de entrenamiento y textbooks— para generar conjuntos de datos sintéticos de alta fidelidad. Estos gemelos son modelos predictivos basados en física que simulan la anatomía, la fisiología y el comportamiento. El flujo de trabajo de la plataforma utiliza un sistema impulsado por LLM para enrutar, validar y sintetizar los diferentes flujos de datos, los cuales luego se procesan a través de un motor de física que genera representaciones detalladas, listas para entrenar modelos predictivos avanzados.

La relevancia de esta tecnología radica en su aplicabilidad transversal. Según explicó Georgia Witchel, fundadora y CEO de Mantis, estos gemelos podrían utilizarse para estudiar y probar procedimientos médicos, entrenar robots quirúrgicos, predecir problemas de salud o incluso patrones de comportamiento. Un ejemplo concreto sería predecir la probabilidad de que un atleta específico de la NFL sufra una lesión en el tendón de Aquiles, integrando datos de su rendimiento reciente, carga de entrenamiento, dieta y tiempo de actividad. A largo plazo, la capacidad de generar datos sintéticos representativos podría acelerar drásticamente el descubrimiento de fármacos, permitir simulaciones clínicas más seguras y abrir la puña a una medicina verdaderamente personalizada, al ofrecer un campo de pruebas virtual para hipótesis donde los datos del mundo real son escasos o inexistentes.

Seguí leyendo en este enlace: https://techcrunch.com/2026/03/30/mantis-biotech-is-making-digital-twins-of-humans-to-help-solve-medicines-data-availability-problem/","https://techcrunch.com/wp-content/uploads/2019/09/brain_pills.jpg?resize=1200,899"
TechCrunch,"ByteDance’s new AI video generation model, Dreamina Seedance 2.0, comes to CapCut",https://techcrunch.com/2026/03/26/bytedances-new-ai-video-generation-model-dreamina-seedance-2-0-comes-to-capcut/,"OpenAI may be dialing back its efforts in the video generation market with theshutdown of its Sora app, but ByteDance on Thursday confirmed that its new audio and video model,Dreamina Seedance 2.0, is now rolling out in its editing platform,CapCut.
ByteDance says the model allows creators to draft, edit, and sync video and audio content by using prompts, images, or reference videos.
The phased rollout will begin with CapCut users in Brazil, Indonesia, Malaysia, Mexico, the Philippines, Thailand, and Vietnam, with more markets added over time.
The news of the launch in CapCut follows a recent report that said themodel’s global rollout would be paused, while it worked to address intellectual property issues that drewcriticism from Hollywoodoveralleged copyright infringement.That likely explains the limited number of markets where the model is currently available within CapCut.
In China, the model is available to users of ByteDance’s Jianying app.
The video generation model works without reference images, even if the creator only uses a few words to describe the scene they have in mind, ByteDance says in itsannouncement. CapCut is also good at rendering realistic textures, movement, and lighting across a range of visual perspectives and angles, which the company notes could be used to edit, enhance, or correct creators’ own footage.
Another use case would be allowing creators to test potential ideas based on early concepts or sketches before filming the real video.
In addition, Dreamina Seedance 2.0 can be used for a wide range of content, including cooking recipes, fitness tutorials, business or product overviews, and videos with motion or action-focused content, where AI video models have historically faced challenges, the company explains.
At launch, the model supports clips of up to 15 seconds long across six aspect ratios.
In CapCut, the model will roll out across different areas, including editing features such as AI Video and generation tools like Video Studio. It will also come to ByteDance’s AI generation platform, Dreamina, and its marketing platform, Pippit.
Given its ability to create realistic content, ByteDance says it has added safety restrictions, so the model won’t have the ability to make videos from images or videos that contain real faces. CapCut will also block the use of unauthorized generation of intellectual property. (However, if the restrictions were working properly, the model would be available now in the United States. Likely, more tweaks are still being made.)
The content produced by Dreamina Seedance 2.0 will also include an invisible watermark, which will help to identify content made with the model when it’s shared off-platform, ByteDance added. This could aid in things like takedown requests from rights holders in the event that the model allowed copyright content through.
ByteDance says it will partner with experts and creative communities as the model rolls out to iterate and improve upon the model’s capabilities.","ByteDance’s new AI video generation model, Dreamina Seedance 2.0, comes to CapCut","(Sin LLM) OpenAI may be dialing back its efforts in the video generation market with theshutdown of its Sora app, but ByteDance on Thursday confirmed that its new audio and video model,Dreamina Seedance 2.0, is now rolling out in its editing platform,CapCut.
ByteDance says the model allows creators to draft, edit, and sync video and audio content by using prompts, images, or reference videos.
The phased rol...
Seguí leyendo: https://techcrunch.com/2026/03/26/bytedances-new-ai-video-generation-model-dreamina-seedance-2-0-comes-to-capcut/","https://techcrunch.com/wp-content/uploads/2026/03/imgi_30_7d51e3a4c1434d7f9b2708a619f3783ftplv-2zwwjm3azk-image.webp?resize=1200,853"
TechCrunch,"Google unveils TurboQuant, a new AI memory compression algorithm — and yes, the internet is calling it ‘Pied Piper’",https://techcrunch.com/2026/03/25/google-turboquant-ai-memory-compression-silicon-valley-pied-piper/,"If Google’s AI researchers had a sense of humor, they would have calledTurboQuant, the new, ultra-efficient AI memory compression algorithm announced Tuesday, “Pied Piper” — or, atleastthat’swhattheinternetthinks.
The joke is a reference to the fictional startup Pied Piper that was the focus of HBO’s “Silicon Valley” TV series that ran from 2014 to 2019.
The show followed the startup’s founders as they navigated the tech ecosystem, facing challenges like competition from larger companies, fundraising, technology and product issues, and even (much to our delight)wowing the judges at a fictional version ofTechCrunch Disrupt.
Pied Piper’s breakthrough technology on the TV show was a compression algorithm that greatly reduced file sizes with near-lossless compression. Google Research’s newTurboQuantis also about extreme compression without quality loss, but applied to a core bottleneck in AI systems. Hence, the comparisons.
So Google TurboQuant is basically Pied Piper and just hit a Weismann Score of 5.2https://t.co/WievkwijjDpic.twitter.com/4rirvu2YyV
Google Researchdescribed the technologyas a novel way to shrink AI’s working memory without impacting performance. The compression method, which uses a form of vector quantization to clear cache bottlenecks in AI processing, would essentially allow AI to remember more information while taking up less space and maintaining accuracy, according to the researchers.
They plan to present their findings at theICLR 2026conference next month, along with the two methods that are making this compression possible: the quantization methodPolarQuantand a training and optimization method calledQJL.
TurboQuant is the new Pied Piper 🤣pic.twitter.com/iMAYJs02zt
So basically TurboQuant is Pied Piperhttps://t.co/Zx9Oq84tSLpic.twitter.com/JPZjz8M3Wp
Understanding the math involved here is something researchers and computer scientists may be able to do, but the results are exciting the wider tech industry as a whole.
If successfully implemented in the real world, TurboQuant could make AI cheaper to run by reducing its runtime “working memory” — known as the KV cache — by “at least 6x.”
Some, like Cloudflare CEO Matthew Prince, areeven calling thisGoogle’sDeepSeek moment— a reference to theefficiency gainsdriven by the Chinese AI model, which was trained at a fraction of the cost of its rivals on worse chips, while remaining competitive on its results.
This is Google’s DeepSeek. So much more room to optimize AI inference for speed, memory usage, power consumption, and multi-tenant utilization. Lots of teams at@Cloudflarefocused on these areas.#staytunedhttps://t.co/hHoY4sLT2I
Well, we all know who stole the Pied Piper codebase nowhttps://t.co/Inv0nlMYnP
Still, it’s worth noting that TurboQuant hasn’t yet been deployed broadly; it’s still a lab breakthrough at this time.
That makes comparisons with something like DeepSeek, or even the fictional Pied Piper, more difficult. On TV, Pied Piper’s technology was going to radically change the rules of computing. TurboQuant, meanwhile, could lead to efficiency gains and systems that require less memory during inference. But it wouldn’t necessarily solve the wider RAM shortages driven by AI, given that it only targets inference memory, not training — the latter of which continues to require massive amounts of RAM.
Pied Piper would have been a better namehttps://t.co/qNZmtANFhs",**Google presenta TurboQuant: el algoritmo de compresión de memoria para IA que revive el legado de ‘Pied Piper’**,"**Google presenta TurboQuant: el algoritmo de compresión de memoria para IA que revive el legado de ‘Pied Piper’**

El anuncio de Google Research sobre un nuevo algoritmo de compresión de memoria para sistemas de inteligencia artificial ha desatado una ola de comentarios en redes sociales que lo bautizaron de inmediato como el “Pied Piper” del mundo real. La referencia es inevitable: al igual que la ficticia startup de la serie *Silicon Valley*, cuyas innovaciones se centraban en una compresión de datos casi sin pérdidas, TurboQuant promete una reducción drástica en la huella de memoria de los modelos de IA sin sacrificar precisión. Este paralelismo cultural subraya la magnitud del problema técnico que aborda: la creciente demanda de memoria (RAM y caché) que limita la eficiencia y escalabilidad de los grandes modelos de lenguaje y otros sistemas de IA.

El desarrollo, detallado en un estudio que será presentado en la conferencia ICLR 2026, introduce dos métodos clave. El primero, **PolarQuant**, es una técnica de cuantización vectorial que permite comprimir los tensores (las estructuras de datos fundamentales en el entrenamiento y ejecución de IA) de manera extremadamente eficiente. El segundo, **QJL**, es un método de entrenamiento y optimización que garantiza que esta compresión agresiva no degrade el rendimiento del modelo. Según los investigadores, la combinación de ambos en el framework **TurboQuant** logra aliviar cuellos de botella críticos en el procesamiento de IA, permitiendo que los modelos “recuerden” más información con un espacio de memoria significativamente menor. Los resultados iniciales reportan un puntaje de eficiencia **Weissman Score de 5.2**, una métrica que evalúa la relación entre tasa de compresión y fidelidad de los datos.

La relevancia de este avance es estratégica para la industria. La expansión descontrolada de los requisitos de memoria de la IA es un obstáculo mayor para la democratización de modelos más grandes, encarece la infraestructura de nube y limita la implementación en dispositivos edge. Una compresión efectiva como la que promete TurboQuant podría reducir costos operativos, acelerar los tiempos de inferencia y permitir el despliegue de modelos avanzados en hardware con recursos más limitados. Aunque su implementación práctica a escala industrial aún requiere validación, el interés generado —junto con la inevitable comparación con la ficción televisiva— señala que la solución de Google a este viejo problema de la computación ha capturado la atención de todo el ecosistema tecnológico.

Seguí leyendo en este enlace: https://techcrunch.com/2026/03/25/google-turboquant-ai-memory-compression-silicon-valley-pied-piper/","https://techcrunch.com/wp-content/uploads/2017/05/section_homepage_bg_2.jpg?resize=1200,675"
