fuente,titulo,url,contenido,titulo_sugerido,resumen,imagenTechCrunch,Nvidia is quietly building a multibillion-dollar behemoth to rival its chips business,https://techcrunch.com/2026/03/18/nvidia-networking-division-building-a-multibillion-dollar-behemoth-to-rival-its-chips-business/,"Nvidia CEO Jensen Huang was years ahead of the market when he pushed the company to start tinkering withbuilding AI-specific chips back in 2010, more than a decade before the current buzz around AI. A similar move in 2020 — doubling down on data center networking with a strategic acquisition — has led to one of the company’s most lucrative and quickly growing divisions, but with little fanfare.
In just a few years, Nvidia’s networking business, designed to connect data centers, has grown into the company’s second-largest revenue driver behind compute. Last quarter, it reported $11 billion in revenue, a year-over-year increase of 267%, and brought in more than $31 billion for the full year, according to Nvidia’smost recent earnings.
Driven by growth in AI processing, the division includes tech like NVLink, which powers communication between GPUs on a data center rack; Nvidia InfiniBand Switches, an in-network computing platform;Spectrum-X, the ethernet platform for AI networking; and co-packaged optics switches, among others.
Together, Nvidia’s networking business includes all the tech needed for building an “AI factory,” a data center designed for training AI models.
Kevin Cook, a senior equity strategist at Zacks Investment research, told TechCrunch that Nvidia’s networking business is one of the most impressive new segments from the company. “[Nvidia’s networking business] reports $11 billion for the quarter; that number is greater than Cisco’s networking business, almost as big as the full-year estimates,” Cook said, adding it does in one quarter what Cisco’s business does in a year.
And yet — the business segment doesn’t draw the same attention as the company’s chip business, which is significantly larger. It also doesn’t get as much fanfare as the company’s gaming business, it’s original bread-and-butter business, which is nearly three times smaller.
The origin of Nvidia’s networking business comes from Mellanox, a networking company founded in Israel in 1999 thatNvidia acquired in 2020 for $7 billion.
Kevin Deierling is a senior vice president of networking at Nvidia. He joined the company through the acquisition of Mellanox. Deierling told TechCrunch that people not knowing about Nvidia’s networking business could be his fault for doing a bad job of marketing it — but he doesn’t like that answer.
“People think of networking as just, ‘I got a printer, and I need to connect to it,’” Deierling said. “Jensen said this the first day when he acquired us, he said the data center is the new unit of computing. Networking is a lot more than just moving the smaller amounts of data between a compute node; it’s actually a foundation.”
While Deierling said he didn’t really understand why Huang bought the company when he did — he gets it now. Having a networking business alongside its GPU business allows the company to sell its chips with the tech that they work best with.
“When Jensen bought Mellanox in 2020, he saw that was the missing piece to make GPUs a complete package,” Cook, the Zack’s analyst, said.
Deierling added that he thinks another aspect of Nvidia’s networking success is that customers can buy the tech as a full-stack solution, as opposed to just individual components, and it doesn’t actually sell the tech itself, but rather through its partners.
“I can’t think of other companies that have [the] full-stack capabilities that we have,” Deierling said. “We are really different. We build the full compute stack, fully integrated stack, and then we go to market through all of our partners.”
Nvidia just announced a whole new slew ofupdates to its networking systemduring Huang’s keynote address on March 16 at the company’s annualNvidia GTC technology conference. The company launched the Nvidia Rubin platform, which includes six new chips to power an “AI supercomputer.” Nvidia also announced a new Nvidia Inference Context Memory Storage platform and more efficient Nvidia Spectrum-X Ethernet Photonics switches, among other products.
“It’s no longer a peripheral to connect the printer, some other slow I/O device,” Deierling said about networking. “It’s fundamental to the computer. In the old days, we had what was called the backplane inside the computer. Today, the network is the back lining of the AI factory, and it’s super important.”
This piece has been updated to better reflect how the company sells its networking infrastructure.",**Nvidia Construye en Silencio un Gigante de Redes que Desafía a su Negocio de Chips**,"**Nvidia Construye en Silencio un Gigante de Redes que Desafía a su Negocio de Chips**

La visión del CEO de Nvidia, Jensen Huang, de anticiparse al mercado se ha convertido en una constante. Si en 2010 impulsó el desarrollo de chips específicos para IA con años de ventaja, una decisión estratégica similar en 2020, con la adquisición de Mellanox Technologies, ha dado lugar a una de las divisiones de más rápido crecimiento y mayor rentabilidad de la compañía, aunque con menor atención mediática que su negocio histórico de GPU. Esta unidad, dedicada a la infraestructura de red para centros de datos, ha evolucionado hasta convertirse en el segundo motor de ingresos de Nvidia, solo por detrás de la división de cómputo.

Los resultados financieros recientes muestran un crecimiento explosivo: la división reportó 11.000 millones de dólares en el último trimestre, un aumento interanual del 267%, y superó los 31.000 millones de dólares en el año completo. Este desempeño se sustenta en un portafolio tecnológico integrado que incluye la interfaz NVLink para la comunicación entre GPUs, los conmutadores y sistemas de red InfiniBand, la plataforma Ethernet Spectrum-X optimizada para cargas de IA y switches con óptica co-empaquetada. En conjunto, estas tecnologías constituyen los componentes esenciales para construir lo que Nvidia denomina una ""fábrica de IA"": un centro de datos especializado en el entrenamiento de modelos de IA a gran escala.

La magnitud del éxito es evidente al compararlo con actores consolidados. Según analistas, los 11.000 millones de dólares trimestrales de Nvidia en redes superan prácticamente la facturación anual total de Cisco en su negocio de networking. Esta división, nacida de una compra estratégica, no solo complementa la oferta de chips, sino que posiciona a Nvidia como un proveedor de infraestructura de extremo a extremo para la era de la IA, reduciendo su dependencia de un solo producto y creando un ecosistema tecnológico profundamente integrado y de alto valor. Su relevancia radica en que transforma a la compañía de un fabricante de componentes a un arquitecto de soluciones completas para el centro de datos inteligente.

Seguí leyendo en este enlace: https://techcrunch.com/2026/03/18/nvidia-networking-division-building-a-multibillion-dollar-behemoth-to-rival-its-chips-business/","https://techcrunch.com/wp-content/uploads/2024/12/GettyImages-2183848584.jpg?resize=1200,800"
Wired,ByteDance’s AI Ambitions Are Being Hampered by Compute Restraints and Copyright Concerns,https://www.wired.com/story/made-in-china-bytedances-ai-ambitions-are-being-hampered-by-compute-restraints/,"Move over Sora 2, there’s a hot new AI video model in town.

In early February, ByteDance unveiled Seedance 2.0, a major upgrade to its flagship video model, which had previously remained fairly obscure. Its powerful capabilities immediately shocked the AI ecosystem in China, even among audiences who had once been skeptical of AI-generated video and viewed the technology mainly as a way to produce slop.

Feng Ji, the founder of Game Science, the studio that developed China’s global hit video game Black Myth: Wukong, wrote online that he was “deeply shocked” by the model’s abilities and believed Seedance 2.0 would pose significant challenges to China’s current copyright regulations and content moderation systems. Pan Tianhong, who leads a Chinese professional video production studio with over 15 million followers on social media, posted a video in which he said Seedance 2.0 is significantly better than any video-making models that came before it. “It thinks like a director,” Pan said.

However, most people can’t get their hands on the model at this moment because access remains fairly restricted. As of this week, ByteDance is only allowing existing users of its consumer-facing AI apps in China—the most popular one is the chatbot app Doubao, but the company also has a confusing constellation of lesser-known apps like Jimeng, Xiaoyunque, and Spark—to experience Seedance 2.0. All these apps are for the Chinese domestic market only, preventing people outside the country from testing the model themselves. (The restrictions have prompted some savvy people in China to resell their ByteDance accounts to eager early AI adopters overseas.)

But there are signs that the model might become more accessible soon. This week, ByteDance updated its API platform and disclosed the proposed pricing of Seedance 2.0: A 15-second video, the longest it can generate right now, would cost slightly more than $2 to make, Chinese publication IT Home estimated. ByteDance still hasn’t opened up API access to third-party developers, but that should be on the horizon.

Afra Wang, author of the Substack newsletter Concurrent and a close observer of the US-China AI landscape, tells me that Seedance 2.0 is another interesting example of how the two countries have taken diverging paths. Even before the release of Seedance 2.0, some of the most established video-making AI tools in the world, such as Kling AI, were developed by Chinese companies. “​​China hasn’t produced any decent AI coding tool, which is why Chinese people are all dependent on Claude Code or Codex; but when it comes to video AI, China is miles ahead of the US,” Wang says.

But all the hype aside, Seedance is running into two serious problems. Weeks into its release, ByteDance is facing a compute bottleneck that is causing the model to take hours to generate a single video. Meanwhile, major movie studios, including Disney, Netflix, and Paramount, have all sent ByteDance cease-and-desist letters alleging that Seedance 2.0’s outputs are infringing on their copyrighted works. ByteDance did not immediately return a request for comment.

The Bandwidth Problem

Even if you get access to a ByteDance AI app, it’s still far from easy to generate a video with Seedance 2.0, because too many people are trying to do the same thing, and ByteDance has yet to provide enough compute resources for everyone.

When I tried to create a clip with one of ByteDance’s apps this week, it told me that I was number 90,985 in the queue, and it would take about four hours to generate a five-second video. After waiting for two hours, the app told me I now had six more to go. At that point, I decided to just go to bed.","**ByteDance lanza Seedance 2.0, pero las restricciones de acceso y los derechos de autor frenan su expansión global**","**ByteDance lanza Seedance 2.0, pero las restricciones de acceso y los derechos de autor frenan su expansión global**

En el competitivo panorama de la inteligencia artificial generativa, ByteDance ha dado un golpe significativo con el lanzamiento de Seedance 2.0, una versión mejorada de su modelo de generación de video. Presentado a principios de febrero, este avance ha generado un impacto considerable en el ecosistema tecnológico chino, incluso entre quienes antes escuchaban con escepticismo las capacidades de la IA para crear contenido audiovisual. Figuras prominentes como Feng Ji, fundador del estudio Game Science (creador del éxito mundial *Black Myth: Wukong*), han expresado su asombro, señalando que la tecnología plantea desafíos inminentes para los marcos regulatorios de derechos de autor y moderación de contenido en China. Por su parte, Pan Tianhong, líder de un estudio de producción profesional con más de 15 millones de seguidores, destacó que el modelo ""piensa como un director"", superando claramente a las alternativas preexistentes en el mercado.

Sin embargo, el alcance de Seedance 2.0 está severamente limitado por restricciones de acceso. Por ahora, ByteDance solo permite probar el modelo a usuarios existentes de sus aplicaciones de IA para el mercado doméstico chino, como Doubao, Jimeng o Spark, bloqueando así el acceso internacional. Esta estrategia cerrada ha generado un mercado secundario de cuentas revendidas a entusiastas en el extranjero. Un indicio de posible apertura surgió esta semana con la actualización de su plataforma API y la divulgación de precios: según estimaciones de *IT Home*, generar un video de hasta 15 segundos, el límite actual, costaría poco más de 2 dólares.

Más allá de las barreras de acceso, el desarrollo de ByteDance se inscribe en un contexto de tensiones geopolíticas y técnicas. Las ambiciones de la compañía en IA se ven coartadas por las restricciones al acceso a capacidad de computación (compute) de alta gama, un recurso crítico para entrenar modelos avanzados, y por la incertidumbre regulatoria en torno a la propiedad intelectual del contenido generado. Seedance 2.0 ejemplifica la rápida evolución de la IA china, pero su trayectoria futura dependerá tanto de su capacidad para sortear limitaciones técnicas como de cómo los legisladores aborden los vacíos legales que su propia innovación expone. Seguí leyendo en este enlace: https://www.wired.com/story/made-in-china-bytedances-ai-ambitions-are-being-hampered-by-compute-restraints/","https://media.wired.com/photos/69a8cd045c3afa23e264984b/191:100/w_1280,c_limit/Made-In-China-ByteDance-AI-Ambitions-Business-1582149003.jpg"
TechCrunch,Cohere launches an open source voice model specifically for transcription,https://techcrunch.com/2026/03/26/cohere-launches-an-open-source-voice-model-specifically-for-transcription/,"Enterprise AI company Cohere on Thursday launched its first voice model: Transcribe is an open source automatic speech recognition model that can be used for tasks like note-taking and speech analysis.
Relatively light at just 2 billion parameters, the model is meant for use with consumer-grade GPUs for those who want to self-host it. It currently supports 14 languages: English, French, German, Italian, Spanish, Portuguese, Greek, Dutch, Polish, Chinese, Japanese, Korean, Vietnamese, and Arabic.
Cohere says Transcribe beats models such as Zoom Scribe v1, IBM Granite 4.0 1B, ElevenLabs Scribe v2, and Qwen3-ASR-1.7B Speech onthe Hugging Face Open ASR leaderboard, achieving an average word error rate (WER) of 5.42, lower than any other model on the benchmark.
The company claims Transcribe had an average win rate of 61% over other models when human evaluators assessed its transcriptions for accuracy, coherence, and usability. However, the model fell behind its rivals when it had to transcribe Portuguese, German, and Spanish.
Cohere says Transcribe can process 525 minutes of audio in a minute, which is high for its class of model.
The company is planning to integrate Transcribe into its enterprise agent orchestration platform,North, and is making the model available through itsAPIfor free. The model will also be available onModel Vault, Cohere’s managed inference platform.
Speech recognition models are growing increasingly popular as demand grows for note-taking and dictation apps like Granola andWispr Flow.
Earlier this year, Cohere reportedlytoldinvestors that it was generating annual recurring revenue of $240 million in 2025, and its CEO, Aidan Gomez, was cited as saying that the startupmay go public “soon”.
",**Cohere presenta Transcribe: modelo de voz de código abierto optimizado para transcripción**,"**Cohere presenta Transcribe: modelo de voz de código abierto optimizado para transcripción**

La empresa de inteligencia artificial empresarial Cohere dio un paso significativo en el ámbito del procesamiento de lenguaje hablado con el lanzamiento de su primer modelo de voz, denominado Transcribe. Este sistema, de arquitectura relativamente ligera con 2 mil millones de parámetros, está diseñado específicamente para tareas de transcripción automática, como la toma de notas y el análisis de discurso, y se distribuye como software de código abierto. Su diseño permite su despliegue en hardware de consumo, como GPUs de gama media, facilitando el auto-hospedaje para organizaciones y desarrolladores.

Transcribe soporta un total de 14 idiomas, entre ellos español, inglés, francés, alemán, portugués, chino y árabe. Según métricas públicas en el benchmark Hugging Face Open ASR, el modelo logra una tasa de error de palabras (WER) promedio de 5.42, superando a competidores establecidos como Zoom Scribe v1, IBM Granite 4.0 1B y ElevenLabs Scribe v2. En evaluaciones humanas sobre precisión, coherencia y usabilidad de las transcripciones, obtuvo una tasa de victoria promedio del 61% frente a otros modelos, aunque mostró un rendimiento inferior en portugués, alemán y español. En eficiencia, puede procesar 525 minutos de audio en un solo minuto, una cifra destacada para su clase.

El lanzamiento responde a la creciente demanda de aplicaciones de dictado y notas inteligentes, un sector donde herramientas como Granola o Wispr Flow están ganando tracción. Cohere integrará Transcribe en su plataforma de orquestación de agentes empresariales, North, y lo ofrecerá gratuitamente a través de su API, además de incluirlo en Model Vault, su plataforma de inferencia gestionada. Este movimiento amplía su cartera de productos más allá de los modelos de texto, posicionándose en un mercado de reconocimiento de voz en expansión. El anuncio se produce en un momento de fuerte crecimiento para la compañía, que según reportes generó 240 millones de dólares en ingresos recurrentes anuales en 2025, y whose CEO, Aidan Gomez, ha mencionado una posible salida a bolsa ""próximamente"".

Seguí leyendo en este enlace: https://techcrunch.com/2026/03/26/cohere-launches-an-open-source-voice-model-specifically-for-transcription/","https://techcrunch.com/wp-content/uploads/2026/03/260325_TranscribeLaunch_Hero.jpeg?resize=1200,600"
TechCrunch,"Nvidia’s DLSS 5 uses generative AI to boost photorealism in video games, with ambitions beyond gaming",https://techcrunch.com/2026/03/16/nvidias-dlss-5-uses-generative-ai-to-boost-photo-realism-in-video-games-with-ambitions-beyond-gaming/,"Nvidia CEO Jensen Huang used the company’s keynote atNvidia GTCon Monday to introduce DLSS 5, a new version of the chipmaker’s AI graphics tech designed to make video games more realistic while using less compute power.
The new DLSS 5 system combines traditional 3D graphics data with generative AI models that can predict and fill in parts of an image, allowing Nvidia’s GPUs to produce detailed scenes and lifelike characters without rendering every element from scratch.
“We fused controllable 3D graphics, the ground truth of virtual worlds, the structured data … with generative AI, probabilistic computing,” Huang said during his keynote speech. “One of them is completely predictive, the other one is probabilistic yet highly realistic.”
Huang said combining those two ideas — structured data with generative AI — allows developers to create content that is “beautiful, amazing, as well as controllable.”
Loading the player…
“This concept of fusing structured information and generative AI will repeat itself in one industry after another,” Huang said. “Structured data is the foundation of trustworthy AI.”
Gaming makes up a smaller portion of Nvidia’s revenue today than it has historically, though that’s the industry that made Nvidia into what it is today. Huang framed DLSS 5’s approach as an example of a broader computing shift, suggesting the approach could extend far beyond gaming and even into enterprise computing.
The billionaire executive pointed to enterprise data platforms such as Snowflake, Databricks, and BigQuery as examples of structured datasets that future AI systems could analyze and generate insights from.
“In the future, what’s going to happen is these data structures are going to be used by AI, and AI is going to be much, much faster than us,” Huang said. “Future agents are going to use structured databases as well as the unstructured database, the generative database. This database represents the vast majority of the world.”",**Nvidia Presenta DLSS 5: IA Generativa para Elevar el Realismo en Videojuegos y Más Allá**,"**Nvidia Presenta DLSS 5: IA Generativa para Elevar el Realismo en Videojuegos y Más Allá**

Durante la conferencia magistral de Nvidia en el evento GTCon, el CEO Jensen Huang anunció DLSS 5, la próxima evolución de la tecnología de gráficos impulsada por inteligencia artificial de la compañía. Esta nueva versión busca un avance significativo en el realismo de los videojuegos, pero con un enfoque que trasciende el entretenimiento digital. DLSS 5 fusiona los datos estructurados tradicionales de los gráficos 3D con modelos de IA generativa que predicen y completan partes de la imagen, permitiendo a las GPU de Nvidia escenas detalladas y personajes convincentes sin renderizar cada elemento desde cero, optimizando así el uso de potencia computacional. Huang lo describió como la unión de ""gráficos 3D controlables, la verdad fundamental de los mundos virtuales"" con ""IA generativa, computación probabilística"", señalando que esta combinación ofrece contenido ""hermoso, asombroso y, lo más importante, controlable"".

Aunque el sector del gaming representa hoy una porción menor de los ingresos de Nvidia en comparación con su historia, fue esta industria la que catapultó a la compañía. Huang enmarcó el enfoque de DLSS 5 como un ejemplo de un cambio de paradigma computacional más amplio. Su ambición es aplicar esta arquitectura que combina datos estructurados y generativos mucho más allá de los videojuegos, extendiéndose a la informática empresarial. El ejecutivo citó plataformas de datos corporativos como Snowflake, Databricks y BigQuery como ejemplos de conjuntos de datos estructurados que futuros sistemas de IA podrían analizar y de los cuales generar insights. ""En el futuro, lo que sucederá es que estas estructuras de datos serán utilizadas por la IA, y la IA será mucho, mucho más rápida que nosotros"", afirmó Huang, sugiriendo que los agentes autónomos del futuro interactuarán tanto con bases de datos estructuradas como con lo que denominó la ""base de datos generativa"", que representa la gran mayoría del mundo. Esta visión posiciona a DLSS 5 no solo como un hito técnico para el rendering, sino como un prototipo de una nueva forma de interacción entre la IA y los datos en escala industrial.

Conocé más en este enlace: https://techcrunch.com/2026/03/16/nvidias-dlss-5-uses-generative-ai-to-boost-photo-realism-in-video-games-with-ambitions-beyond-gaming/","https://techcrunch.com/wp-content/uploads/2026/03/nvidia-dlss-5.jpeg?resize=1200,675"
